index,attendance_mandatory,clarity_rating,class,comment,created_by_user,date,difficulty_rating,grade,helpful_rating,is_for_credit,is_for_online_class,quality_rating,rating_tags,textbook_use,thumbs_down_total,thumbs_up_total,would_take_again,pid
0,non mandatory,5.0,MATH211,"His eccentricity is well-known, but Gao's an effective professor with some legendary quips. On a more serious note, he makes great use of lecture time to explain each topic thoroughly and he answers questions well. Your experience with him will be great if you show up to class and take your notes.",False,2024-12-17 12:46:41,3.0,,5.0,True,False,5.0,Participation matters--Hilarious--Test heavy,-1.0,0,0,1.0,141412
1,non mandatory,5.0,MATH102,Professor Gao has been the most caring professor I have ever have in college. He really makes himself available to help students outside of class. His office hours always end up being a collaboration space where other students come together and he guides our learning. He is very understanding and will guide classes with great questions.,False,2020-12-19 17:43:53,3.0,A+,5.0,True,False,5.0,Accessible outside class--Participation matters--Caring,5.0,0,0,1.0,141412
2,mandatory,5.0,MATH212," Professor Gao is amazing. Highly recommend. He makes even a difficult and tedious class, Multivariable Calculus, seem fun and easy. Lectures are hysterical too.",False,2015-10-06 01:25:53,2.0,,4.0,True,False,5.0,,4.0,1,2,,141412
3,,5.0,MATH212,I would love to take more classes with Prof. Gao. I will definitely miss him. ,False,2014-12-08 14:21:53,2.0,,5.0,True,False,5.0,,3.0,1,1,,141412
4,,5.0,MATH212,he is the best!,False,2013-08-27 19:36:28,1.0,,5.0,False,False,5.0,,5.0,0,0,,141412
5,,2.0,MATH102,"Mr. Gao was a really nice man. If you have trouble understanding native Chinese speakers' accents, you may have an issue, though. His explanations were very thorough, but he didn't give us much time to process the information he taught us and went at a fast pace. Nice guy, but there are better teachers out there.",False,2011-01-01 14:16:14,3.0,,3.0,False,False,3.0,,5.0,4,0,,141412
6,,2.0,MATH300,not at all helpful outside of the classroom.,False,2009-08-13 16:03:39,3.0,,1.0,False,False,2.0,,2.0,1,0,,141412
7,,3.0,MATH211,"Great at entertaining he class, not so great at teaching it...doesnt do much explaining...and the homework sets can get tiresome...first two tests are a breee though",False,2008-01-03 02:24:50,2.0,,2.0,False,False,3.0,,3.0,0,1,,141412
8,,2.0,MATH211,"Entertaining teacher. Tests are just like previous years.  2 Midterms, 1 Final +HW and a project. Easy to get a good grade, but HW still takes time. Dont really learn much from class since Gao just tells you how to do something, not what it is actually happening.  If u just need it for a major requirement/distribution and not knowledge, good class.",False,2006-12-18 22:58:16,2.0,,2.0,False,False,2.0,,3.0,1,0,,141412
9,,2.0,MATH211,Study old tests!!,False,2005-12-09 17:06:17,2.0,,2.0,False,False,2.0,,,0,1,,141412
10,,4.0,MATH211,"Funniest teacher you will ever have. The day before exams, he goes over everything that will be on the exam. And not just what might be on the exam. He literally numbers the topics as he reviews them, and the numbers match up with questions on the exam.",False,2005-11-29 14:48:03,2.0,,3.0,False,False,4.0,,,0,1,,141412
11,,5.0,MATH102211,"study the old tests cuz every year they're exactly the same, he just changes the numbers. definitely an easy A",False,2005-10-17 22:18:48,1.0,,3.0,False,False,4.0,,,0,0,,141412
12,Y,3.0,DIFFE,awesome. the gaoster,False,2005-10-10 14:16:27,2.0,B-,3.0,False,False,3.0,,,1,0,,141412
13,,5.0,MATH211,Gao rocks you.,False,2005-10-10 02:08:16,3.0,,5.0,False,False,5.0,,,0,0,,141412
14,,2.0,MATH211,sucks. worthless unless you're an academ. you learn absolutely nothing in this class beyond how to solve gao's problems. take math 221/222 or just learn it on your own.,False,2005-07-12 11:39:59,1.0,,1.0,False,False,2.0,,,0,0,,141412
15,,5.0,MATH201,"GAO: YAN CAN CALCULUS. The man rocks.",False,2004-11-28 22:48:54,2.0,,4.0,False,False,5.0,,,0,0,,141412
16,,4.0,MATH222,"He was kind of disorganized, but he was very funny. Once you got past the accent, I think he explained things fairly clearly as well.",False,2004-10-21 16:24:41,1.0,,3.0,False,False,4.0,,,0,0,,141412
17,,5.0,MATH102,Dr gao is an easy math prof,False,2004-07-09 11:50:07,1.0,,5.0,False,False,5.0,,,0,0,,141412
18,,4.0,MATH102,No Comments,False,2004-07-09 11:48:38,2.0,,5.0,False,False,5.0,,,0,0,,141412
19,,5.0,MATH102,funny funny,False,2004-06-29 00:55:29,2.0,,4.0,False,False,5.0,,,0,0,,141412
20,,4.0,MATH102,HAHA,False,2004-04-18 19:55:54,1.0,,4.0,False,False,4.0,,,0,0,,141412
21,,4.0,MATH102,No Comments,False,2004-04-01 23:22:33,3.0,,4.0,False,False,4.0,,,0,0,,141412
22,,4.0,MATH102,"Very easy, but he only taught about 7 concepts for the entire class.  Not a prof for someone who really loves math.",False,2003-09-19 20:08:52,1.0,,2.0,False,False,3.0,,,0,0,,141412
23,,2.0,MATH222,"did not cover much material.  moved slowly for the level of students in the class.  while he showed many of the attributes that would make him a popular teacher, he did not show any that make him a GOOD teacher.",False,2003-06-23 11:29:37,2.0,,2.0,False,False,2.0,,,0,0,,141412
24,,4.0,MATH212,No Comments,False,2003-04-28 17:17:26,2.0,,4.0,False,False,4.0,,,0,0,,141412
25,,5.0,MATH102,"if you take-a square root, god will punish you!",False,2003-02-24 09:58:11,1.0,,5.0,False,False,5.0,,,0,0,,141412
26,,4.0,MATH102,funny guy...in 102.  but not in 212,False,2003-02-20 16:30:09,2.0,,3.0,False,False,4.0,,,0,0,,141412
27,mandatory,2.0,CHEM,"Mr. Tour's class is peculiar. He's knowledgeable, but doesn't mean he's good, he doesn't put good effort into teaching. He's a bit disconnected from chem, he oversells himself while inserting personal views that have nothing to do with it. And despite his knowledge he's boring and by-the-numbers. Take another professor or prepare to teach yourself.",False,2024-04-30 01:52:27,4.0,C,2.0,True,False,2.0,Tough grader--Test heavy,3.0,0,0,,182001
28,mandatory,1.0,CHEM212,"Now the world is gone, I'm just one
Oh God, help me",False,2024-04-25 16:10:01,5.0,F,1.0,True,False,1.0,Tough grader--Get ready to read--Participation matters,3.0,0,0,,182001
29,non mandatory,1.0,CHEM212,Brings his religion into the classroom. ,False,2024-03-15 21:51:53,4.0,B+,1.0,True,False,1.0,So many papers--Graded by few things,3.0,0,1,,182001
30,mandatory,1.0,CHEM251,Terrible professor. Constantly injects religion and politics into his lectures. Can't believe students have to be subjected to this and with such a hard subject.,False,2023-12-20 11:05:03,1.0,C-,1.0,True,False,1.0,Tough grader--Lots of homework--Test heavy,3.0,0,2,,182001
31,mandatory,5.0,CHEM251,Difficult class.  He knows OC and expects you to know it also.  You MUST study.  Exams are hard if not prepared.  He will ask test questions that require synthesized information ... not just textbook regurgitation.  Interesting sense of humor.  Truly cares about students.,False,2023-05-19 04:25:38,5.0,A-,5.0,True,False,5.0,Hilarious--Caring--Test heavy,3.0,1,1,1.0,182001
32,mandatory,4.0,CHEM211,He was great but he seemed distant and I relied solely on the other teachers for help,False,2021-02-19 23:49:52,4.0,A-,4.0,True,False,4.0,Test heavy--Lecture heavy,5.0,0,3,1.0,182001
33,,2.0,CHEM211,"He gave hard tests. However, my biggest complaint is that he went on tangents instead of teaching o-chem. To make matters worse, he tested on the tangents. One test question asked about the 2010 nobel prize. Also, the quizzes took time away from practicing the problems in the book; the problems in the book provided more benefit than the quizzes.",False,2012-11-29 23:07:37,5.0,,2.0,False,False,2.0,,5.0,1,3,,182001
34,,1.0,CHEM215,"Not a good prof...teaches orgo straight from the book and if you don't understand it there, you're screwed.",False,2009-09-22 16:35:26,5.0,,1.0,False,False,1.0,,5.0,1,4,,182001
35,,2.0,CHEM211,"He's interesting to listen to, but gives uber-hard tests.",False,2008-11-07 19:02:42,5.0,,2.0,False,False,2.0,,5.0,1,2,,182001
36,,2.0,CHEM211,"Annoying, arrogant, and generally not fun to be around.",False,2005-06-01 22:49:42,5.0,,2.0,False,False,2.0,,,1,3,,182001
37,,5.0,CHEM251,"Excellent teacher.He knows Chemistry and he really cares about the students;he even has students over at his house for lunch EVERY Sunday.A difficult but worthwhile class.He's opinionated,but it's clear that he's not trying to force his opinions on to others but comically inform them of his own.",False,2004-11-24 14:21:28,4.0,,5.0,False,False,5.0,,,2,2,,182001
38,,3.0,CHEM213,"Good teacher.  Very biased, very arrogant, but knows the material and expects you to know it just as well.  So if you're up for a challenge, he's the one to take.  If you don't like Organic, take someone else's class because you will suffer in his.",False,2004-10-22 01:14:39,5.0,,3.0,False,False,3.0,,,1,2,,182001
39,,5.0,CHEM251,"Dr. Tour is an extremely good teacher.  However he expects you to learn your material.  He will often throw questions on the test that require a person to apply their knowledge, rather than regurgitate it.",False,2004-08-27 00:57:31,4.0,,4.0,False,False,5.0,,,1,1,,182001
40,,3.0,CHEM212,No Comments,False,2004-03-03 23:35:51,2.0,,3.0,False,False,3.0,,,0,0,,182001
41,,5.0,CHEM212,A memorable course indeed -- an orgo class that requires students to think about real-world issues!  This prof certainly is passionate about two things -- GOD and orgo...,False,2003-12-01 19:53:13,4.0,,4.0,False,False,5.0,,,1,1,,182001
42,,4.0,CHEM212,"The material on the exams are not based on understanding, but on stupid memorization.  He also injects his political and religious views into a chemistry class--no small feat.  He is extremely arrogant.",False,2003-09-19 20:15:08,5.0,,1.0,False,False,3.0,,,1,3,,182001
43,,1.0,CHEM211,He sucks. He puts his religious beliefs on his test and just sucks a lot.,False,2003-09-15 21:17:16,5.0,,1.0,False,False,1.0,,,1,3,,182001
44,,1.0,CHEM212,Dr. Tour frequently inserts his personal political beliefs into the course. He is unforgiving and does not like most students.,False,2003-04-24 20:36:55,5.0,,2.0,False,False,2.0,,,1,3,,182001
45,,1.0,CHEM,No Comments,False,2003-04-07 17:57:22,5.0,,1.0,False,False,1.0,,,1,1,,182001
46,non mandatory,5.0,SOCI364,One of my favorite professors by far!,False,2018-06-19 15:20:45,3.0,A,5.0,True,False,5.0,Gives good feedback--ACCESSIBLE OUTSIDE CLASS--Caring,0.0,0,0,1.0,2111513
47,mandatory,5.0,SOCI231,10/10 would recommend. You should take at least one class with Considine in your undergraduate career as he gives you a lot of autonomy in how you utilize the classroom space and gives you room to grow as a person and as an individual.,False,2018-02-03 07:03:50,2.0,A,5.0,True,False,5.0,Respected--Skip class? You won't pass.--Amazing lectures,0.0,0,1,1.0,2111513
48,mandatory,5.0,SOCI231,"Considine is the best! Tries his very best to make the class relevant, manageable, and still interesting. Takes student feedback into account like no other and keeps the focus on learning and hands-on work instead of on worrying about tests and grades.",False,2018-02-03 07:02:09,3.0,A,5.0,True,False,5.0,Respected--Inspirational--Caring,0.0,0,0,1.0,2111513
49,mandatory,5.0,SOCI364,"Considine did a great job of guiding us in the projects, providing individualized feedback and making time for students, one of the best professors ever! This is his area of expertise which sometimes meant he gave too much advice with the projects but overall he was really helpful. He is a wonderful resource.",False,2018-02-02 08:35:21,4.0,A,5.0,True,False,5.0,Gives good feedback--Respected--GROUP PROJECTS,0.0,0,0,1.0,2111513
50,mandatory,5.0,SOCI384,"Dr. Considine is truly a special teacher. He is so engaged with his students and so incredibly helpful and supportive throughout the learning process. He gives students the space to learn and expand, while encouraging them along the way. He respects his students more than any professor I've had at Rice.",False,2018-01-28 09:16:07,5.0,A-,5.0,True,False,5.0,Gives good feedback--Participation matters--GROUP PROJECTS,0.0,0,0,1.0,2111513
51,mandatory,5.0,SOCI403,"Dr. Considine is an incredible professor and a valuable mentor. He is by far one of my favorite professors at Rice, and I'm glad I was able to have him guide us on this independent study over the course of the semester. It was an incredibly rewarding experience have Dr. Considine guide us through an independent research project.",False,2018-01-27 07:56:22,3.0,A,5.0,True,False,5.0,Respected--Inspirational--ACCESSIBLE OUTSIDE CLASS,0.0,0,0,1.0,2111513
52,mandatory,5.0,SOCI364,Craig goes above and beyond what any other professor I've had ever has. If you ask a question in class he'll follow up with an email after class offering even more information and plenty of links to follow. He is incredibly invested in teaching and in his students' learning experiences. If anything he almost devotes too much of his own time to help,False,2018-01-21 07:24:46,3.0,A,5.0,True,False,5.0,Respected--Participation matters--Inspirational,0.0,0,0,1.0,2111513
53,mandatory,5.0,SOCI364,"Dr. Considine is very knowledgeable in the subject, it just seems that he underestimates how much he can challenge his students as class discussions can often lack much intellectual stimulation. Otherwise, he's a great resource and very helpful throughout the semester.",False,2018-01-21 07:23:25,2.0,A,5.0,True,False,5.0,Respected--Participation matters--ACCESSIBLE OUTSIDE CLASS,0.0,0,0,1.0,2111513
54,mandatory,5.0,SOCI364,"Professor Considine is probably one of the greatest instructors I've had at Rice. Not only is he extremely knowledgeable about the subject matter, you can tell he's truly passionate about what he teaches. What sets him apart is his commitment to his students. Soon after the first day of class, he emailed me personally to elaborate on a topic I brie",False,2018-01-21 07:21:40,3.0,A,5.0,True,False,5.0,Inspirational--ACCESSIBLE OUTSIDE CLASS--Caring,0.0,0,0,1.0,2111513
55,mandatory,5.0,SOCI364,Craig is always an amazing professor to have because he loves what he does and is so passionate about the subjects he teaches!,False,2018-01-21 07:20:15,2.0,A,5.0,True,False,5.0,ACCESSIBLE OUTSIDE CLASS--Caring--GROUP PROJECTS,0.0,0,0,1.0,2111513
56,mandatory,5.0,SOCI364,"Dr. Considine was an absolute fantastic Professor. He was clearly really knowledgable and passionate about the information and learning from him was really helpful. He also allowed room for much critical discussion, which helped create an interactive classroom atmosphere.",False,2018-01-21 07:18:38,3.0,A,5.0,True,False,5.0,Gives good feedback--Respected--Participation matters,0.0,0,0,1.0,2111513
57,mandatory,5.0,SOCI231,Everyone needs to take a class with Dr. Considine. He is very passionate about what he teaches and does a great job of engaging with students and fostering discussion in class. He is also so so nice and encouraging to his students. He is really supportive of everyone and ensures that everyone has what they need in order to succeed in the class.,False,2017-09-25 08:16:48,3.0,A-,5.0,True,False,5.0,,0.0,0,0,1.0,2111513
58,non mandatory,5.0,SOCI364,Craig is clearly passionate about this subject. Presents facts and encourages engagement with the material. He changed my life with this course.,False,2017-09-25 08:12:36,3.0,A,5.0,True,False,5.0,Inspirational--Amazing lectures--Caring,0.0,0,0,1.0,2111513
59,non mandatory,5.0,SOCI364,"Professor Considine was very knowledgeable about the topic and event with the election tried to keep a very open mind about it. Though his personal views did skew things a bit, the class was still very interesting and his presentation and engagement with the class was great.",False,2017-04-28 18:39:58,2.0,A-,5.0,True,False,5.0,Gives good feedback--Respected--Caring,5.0,0,0,1.0,2111513
60,non mandatory,5.0,SOCI364,This teacher is very organized and knowledgeable about this subject. He is passionate about it and very understanding to his students. He does an amazing job teaching. I can't say it enough I really enjoyed this class. It's an amazing class.,False,2017-03-26 12:37:45,3.0,A,5.0,True,False,5.0,Inspirational--ACCESSIBLE OUTSIDE CLASS--Caring,0.0,1,0,1.0,2111513
61,mandatory,5.0,SOCI364,Dr. Considine is awesome. He is an expert in his field and also brings in a lot of esteemed guest lecturers who are also experts in the field. Every single class he facilitates amazing discussion and makes the material very interesting.,False,2017-03-21 15:29:54,2.0,A,5.0,True,False,5.0,Respected--Inspirational--ACCESSIBLE OUTSIDE CLASS,0.0,0,0,1.0,2111513
62,non mandatory,5.0,SOCI364,"Dr. Consiidne is the best. Besides being extremely knowledgeable and well connected, he is very caring and supportive. He always thinks from the students' perspective, and he helps his students in every aspect that he can. Very approachable and down to earth. I'm going to take more of his courses in the future.",False,2017-03-15 15:58:07,3.0,A,5.0,True,False,5.0,Participation matters--Inspirational--Amazing lectures,0.0,0,0,1.0,2111513
63,mandatory,5.0,SOCI364,Dr. Considine knows his stuff. I learned a lot from him.,False,2016-04-01 21:16:36,2.0,,5.0,True,False,5.0,,1.0,7,0,,2111513
64,non mandatory,5.0,PSYC202,She's super passionate about the subject and makes the class really fun.,False,2020-11-28 17:46:47,2.0,A+,5.0,True,True,5.0,Accessible outside class--Amazing lectures--Caring,5.0,0,0,1.0,136273
65,mandatory,5.0,PSYCH212,"Amazing teacher, genuinely one of the nicest people I have ever met. She has a sort of enthusiastic aura that perks you up even when you're tired. She tries to make very fair tests and does fun class demonstrations. Definitely recommend taking a class with her.",False,2020-10-20 04:52:00,3.0,A-,5.0,True,False,5.0,Gives good feedback--Accessible outside class--Inspirational,5.0,0,0,1.0,136273
66,,5.0,PSYC202,"Hebl is such a fantastic professor. Classes were so inspiring every time, she's one of the best at Rice!",False,2012-03-29 11:18:07,3.0,,5.0,False,False,5.0,,4.0,4,0,,136273
67,,5.0,PSY203,"Loved her lectures, tests were fair, pretty fun class. Journals were useless busy work and got annoying very quickly. Had no problem til the end of the semester when she miscalculated my grade. Very hard to get a hold of her to this to fix this, multiple emails before any response. Probably won't take her class again because of the grading error.",False,2008-10-25 14:01:26,3.0,,4.0,False,False,5.0,,4.0,0,0,,136273
68,,4.0,PSYC202,Made class fun.  My only major critism is the lack of the accountability she puts on the TAs. Check over your grade calculation at the end of the class--my grade was .5 too low due to a silly calculation error and it was corrected to bring my grade up.  A few other students had this problem.,False,2008-05-20 19:58:13,2.0,,4.0,False,False,4.0,,3.0,0,0,,136273
69,,5.0,PSYCGEND,she really does have an amazing laugh. best professor at rice,False,2007-02-13 17:49:01,3.0,,5.0,False,False,5.0,,3.0,0,0,,136273
70,,5.0,PSYC260,"Mikki is my favorite prof at Rice. She is very helpful, and every psych major should take this class. She helps you to figure out what you want to do and how to achieve it.",False,2005-11-09 14:39:33,2.0,,5.0,False,False,5.0,,,0,0,,136273
71,,5.0,PSYCHOFGENDER,Mikki is by far the best psych professor at Rice.,False,2005-09-26 21:52:40,3.0,,5.0,False,False,5.0,,,0,0,,136273
72,Y,5.0,2002,No Comments,False,2005-08-31 10:50:09,3.0,C,5.0,False,False,5.0,,,0,0,,136273
73,,5.0,PSYCHOFGENDER,I really enjoy the class.  She keeps it very interesting and has a lot of energy.,False,2005-08-30 20:33:23,3.0,,5.0,False,False,5.0,,,0,0,,136273
74,,5.0,PSYCH331,Hebl is such a fun professor. Her laugh is so amazing. She makes even the  most stupid topics fun and interesting. Make sure to take her class and also get to know her. A++,False,2005-08-30 17:14:56,2.0,,5.0,False,False,5.0,,,0,0,,136273
75,,2.0,PSYC340,Enthusiastic but not deep.,False,2005-04-03 19:07:48,1.0,,3.0,False,False,3.0,,,0,0,,136273
76,,5.0,INTROTOIO,Manages to make a potentially dull subject interesting and is one of the most helpful professors I have ever seen in office hours.,False,2005-03-31 16:11:35,3.0,,5.0,False,False,5.0,,,0,0,,136273
77,,5.0,PSYC202,I'm shocked that there are only a few ratings up here. When I had Mikki at Rice there was an article in the newspaper about students sleeping in the registrars office to get into her classes... she is the best prof at Rice.,False,2004-10-24 14:51:43,3.0,,5.0,False,False,5.0,,,0,0,,136273
78,,5.0,PSYC202,Mikki is the best teacher I have had at Rice.  Even if you aren't a psych major this class is worth taking!,False,2004-01-02 16:23:47,3.0,,4.0,False,False,5.0,,,0,0,,136273
79,,5.0,PSYC202,Took Social Psych with her and loved it! I can't wait to take another course with her. There's a reason that there are huge lines for her office hours and people sitting on the floor of a lecture hall for her 8 AM classes! Take her class if you can!,False,2003-12-19 19:43:30,2.0,,5.0,False,False,5.0,,,0,0,,136273
80,,5.0,PSYCH200,Mikki is an amazing professor.  I've never learned as much as I have in her class.  She is the best-ever.,False,2003-10-23 17:53:54,5.0,,5.0,False,False,5.0,,,0,0,,136273
81,,5.0,PSY,No Comments,False,2003-06-24 18:04:02,3.0,,5.0,False,False,5.0,,,0,0,,136273
82,mandatory,5.0,BIOS201,"Dr. Gustin was awesome. Even years later, I still remember his lectures and how engaging they were. I am amazed how interesting he made cell bio and his old-school methods of writing and drawing on the chalk-board instead of using powerpoints. Super cool guy and really respect him as a professor. ",False,2025-01-20 23:22:52,4.0,A,5.0,True,False,5.0,Get ready to read--Amazing lectures --Respected,3.0,0,0,1.0,476772
83,non mandatory,5.0,BIOS201,"Dr. Gustin is honestly so nice, and I would absolutely recommend him to anyone's who's interested in Biology. We're a class of about 150 students but he still takes the time to try and get to know each and every one of us. The grading for his classes is also ACTUALLY designed to help students pass as long as the work hard and stay on top of things.",False,2022-10-21 07:27:04,3.0,A-,5.0,True,False,5.0,Get ready to read--Clear grading criteria--Caring,3.0,0,0,1.0,476772
84,non mandatory,5.0,BIOS201,The topics can be a little confusing but he's really passionate about the subject and makes every lecture really interesting. He's also really helpful if you ask for it.,False,2020-11-28 17:49:05,3.0,A,5.0,True,False,5.0,Inspirational--Lecture heavy--Caring,5.0,0,0,1.0,476772
85,mandatory,3.0,BIOC201,His lectures are kind of hard to follow as he tends to skip around a bit. There isn't a lot of flow between each lecture. It's obvious that he's passionate about bio though and he's a really nice guy. His review sessions are helpful. The multiple choice pre-class quizzes are kind of tricky bc of the wording.,False,2017-12-18 17:40:19,4.0,B,3.0,True,False,3.0,Respected--Skip class? You won't pass.--LECTURE HEAVY,5.0,1,0,0.0,476772
86,non mandatory,3.0,BIOC201,"Very good lecturer, but the class is very deep. Hard when you don't have an AP Bio background. ",False,2015-12-13 22:14:04,5.0,Drop/Withdrawal,4.0,False,False,4.0,,5.0,0,1,,476772
87,,2.0,BIOC201,"Gustin's great until the test happens. He can be a little all over the place but I enjoyed his lectures. The tests are cumulative and have a horrendous MCQ section and you have know all sorts of minutiae. Great lecture, and Gustin's a really fun guy, but you have to gain a very in depth knowledge of the material to do well on tests.",False,2014-12-17 03:00:50,4.0,,4.0,True,False,3.0,,5.0,1,0,,476772
88,,2.0,BIOS201,"He was a nice guy, but if biology isn't your thing then the tests will destroy any shred of confidence you may have built up beforehand.",False,2006-01-02 01:01:54,5.0,,3.0,False,False,3.0,,,0,0,,476772
89,,5.0,BIOS201,"Gustin really cares about teaching and it shows.  He may not be the &quot;coolest&quot; guy around, but he's very approachable and helpful.  Lectures were never a waste of time, which is hard to do in an intro bio class.   Tests challenging, but fair.",False,2005-10-07 23:34:51,1.0,,5.0,False,False,5.0,,,0,0,,476772
90,,5.0,BIOS201,"awesome, awesome prof. make sure to go to office hrs before tests to get extra help (other than the review sessions). and never fall behind on reading cuz that'll kill",False,2005-10-03 00:37:21,4.0,,5.0,False,False,5.0,,,0,0,,476772
91,,4.0,BIOS201,"Really nice guy. Lectures were decent, keeping in mind he is covering SO much elementary Biology material. Tests were a tad bit confusing and method of grading them seemed rather unfair. Make sure to go to his review sessions the night before the exam.",False,2005-08-30 17:13:31,4.0,,4.0,False,False,4.0,,,0,0,,476772
92,,2.0,BIOS201,"he needed work slowing and organizing his lectures...multiple choice test questions are hard and not well designed, but essays are easy",False,2005-07-12 22:54:00,3.0,,3.0,False,False,3.0,,,1,0,,476772
93,,5.0,BIOS201,"His exams are brutal, but he made the material clear enough that I still did well.",False,2005-06-01 22:36:56,4.0,,5.0,False,False,5.0,,,0,0,,476772
94,,1.0,BIOS201,interesting professor but incredibly tough class.,False,2005-04-25 11:46:49,5.0,,3.0,False,False,2.0,,,0,0,,476772
95,,3.0,BIOS201,He was a terrific prof!,False,2005-04-08 13:07:32,4.0,,5.0,False,False,4.0,,,1,0,,476772
96,,4.0,BIOS201,No Comments,False,2005-01-11 11:23:24,4.0,,5.0,False,False,5.0,,,0,0,,476772
