index,attendance_mandatory,clarity_rating,class,comment,created_by_user,date,difficulty_rating,grade,helpful_rating,is_for_credit,is_for_online_class,quality_rating,rating_tags,textbook_use,thumbs_down_total,thumbs_up_total,would_take_again,pid
0,Y,5.0,WCWP10A,"Dr. Gocsik is perhaps the best professor I've had in life. She facilitates class discussion in a way that your opinions will be heard and weighted. Karen also goes over different aspects of the world in and out of class, and she's the person to turn to if you want to talk just about anything. My writing improved A LOT in her class.",False,2014-04-24 21:19:11,3.0,A,5.0,False,False,5.0,,5.0,0,2,,1100359
1,Y,5.0,WCWP10A,"She teaches at UCSD now and is by far the best writing teacher I've had in a while. The class itself isn't of the best structure (everything is geared towards 3 essays, where the last essay practically dictates your grade). She actually teaches you how to write better, but the class is time consuming.",False,2014-02-19 00:01:06,4.0,A,4.0,False,False,5.0,,5.0,0,2,,1100359
2,,3.0,WCWP10A,"Now a UCSD prof for Warren college. Very unlikeable GE class. Only 3 grades, which are the 3 final papers. Time consuming but the grading is very fair--so much so that it basically rewards already good writers and the rest will get a B+ or below. I did not learn to write better, but at least the topic (technology) was interesting to read about.",False,2014-01-13 18:20:49,4.0,,3.0,False,False,3.0,,5.0,0,1,,1100359
3,,4.0,WRIT2,"Prof. Gocsik through me into the deep end during freshman fall since her class has been the indisputably tough. Despite the intense discussions, complex texts and multiple drafts of papers, I now look back at the class with a sense of accomplishment and relief. I am no longer afraid to write and am confident in my writing ability.",False,2010-06-15 22:49:37,5.0,,5.0,False,False,5.0,,5.0,0,1,,1100359
4,,5.0,WRIT003,Demanding but great professor. The classes are great!!,False,2010-02-27 01:45:12,5.0,,5.0,False,False,5.0,,5.0,0,1,,1100359
5,,5.0,WRIT2,"Karen has taken the &quot;none&quot; out of my nonsensical writing, and made it &quot;sense&quot;. She is the best professor I have ever had. K is genuinely dedicated to the success of her students- both in and out of the classroom. You can talk to her about just anything. And her inner glow is what keeps students motivated despite the mammoth course load.",False,2010-02-27 00:00:37,5.0,,5.0,False,False,5.0,,4.0,0,0,,1100359
6,,5.0,WRIT23,"Karen is the highlight of my academic experience at Dartmouth. She taught me how to write papers from scratch, until I got an A. She is a very hardworking and interesting teacher, who makes a class so interesting, that the student is injected with the desire/impatience to share his opinions when going to class. It was a pleasure to be  her student.",False,2008-12-01 16:42:15,3.0,,5.0,False,False,5.0,,5.0,0,1,,1100359
7,,5.0,WRIT2,The best class I've taken at Dartmouth and the reason I know how towrite A papers now,False,2008-08-15 23:47:20,5.0,,5.0,False,False,5.0,,4.0,0,0,,1100359
8,,4.0,ENGL009,"Karen cares about her students, and she cares about them deeply. She injects energy into every classroom she walks into as well. Her knowledge of our culture is phenomenal, and she likes to argue her points until she has beat the living daylight out of all the angles. I suggest Karen wholeheartedly.",False,2008-06-09 01:23:54,3.0,,5.0,False,False,5.0,,1.0,0,0,,1100359
9,,5.0,WRIT2,"Karen's Writing 2-3 classes are known as some of the most hardcore classes at Dartmouth... but you learn so much that it's well worth it. I wish I could find other classes at D that made me think as much as Karen's class did. She gives a lot of work, but puts as much care into the class as we do, often staying up until 4am or later marking papers.",False,2008-06-04 17:08:32,3.0,,5.0,False,False,5.0,,5.0,0,0,,1100359
10,,5.0,WRIT2,Karen achieves a perfect balance between laying out an argument that an author has made and making her students think creatively and deeply about it. HEr class was one of the most intellectually stimulating classes I have had and my writing skills improved to a surprisingly high degree.,False,2008-04-19 12:09:41,4.0,,4.0,False,False,5.0,,4.0,0,0,,1100359
11,,4.0,WRIT2,No Comments,False,2008-04-18 12:44:43,4.0,,5.0,False,False,5.0,,3.0,1,0,,1100359
12,,4.0,WHIT002,"Great prof, great person!",False,2008-04-11 16:48:27,1.0,,5.0,False,False,5.0,,4.0,0,0,,1100359
13,,5.0,ENG0203,"If I could, I'd take Karen's class again. She is one of the most caring, intelligent and dedicated professors ever. Her class is always full of energy and thought provoking. She will guides you through to become a better writer, independent and logical thinker, and eloquent communicator. You'll be another one very lucky person if you learn from her",False,2008-04-10 21:01:40,5.0,,5.0,False,False,5.0,,4.0,0,0,,1100359
14,,5.0,WRIT3,"Karen is not simply a teacher, she is a true mentor, capable of truly connecting with various students. On a continent where unfortunately I have not men too many intellectuals, Karen is one of the few who taught me how to be a confident thinker, who feels free to ALWAYS raise questions rather than focus on the answers. Love learning&#63;=&gt; Karen!!!",False,2008-04-09 15:25:52,4.0,,5.0,False,False,5.0,,3.0,0,0,,1100359
15,,1.0,WRIT2,No Comments,False,2008-04-08 22:01:44,3.0,,1.0,False,False,1.0,,2.0,3,0,,1100359
16,,4.0,WRIT2,"The professor has done a lot of preparation for class in order to equip the students with great writing and discussion skills.  The assignments, although quite hard and sometimes can be quite painful, have brought me out of my comfort zone which eventually ends up widening my comfort zone as well.",False,2008-04-08 15:05:15,4.0,,4.0,False,False,4.0,,3.0,0,0,,1100359
17,,5.0,WRIT2,"Karen is a great professor! She really cares about teaching, and she is a very accessible professor as well. Her teaching methods are extremely innovative and involve lots of class discussion. Karen is a hard but fair grader, and her grades are always accompanied by large amounts of feedback and comments. If you want to learn you will not go wrong.",False,2008-04-08 13:58:17,5.0,,5.0,False,False,5.0,,1.0,0,0,,1100359
18,,5.0,WRIT002,"Karen is responsible for  teaching students, many of whom do not speak English as their first language, how to think and write in English. She's a great Prof because she gives up her time and effort to ensure that her students excel. She gives her time at literally whatever time of day respond to concerns of her students, sort through confusion et",False,2008-04-08 11:37:57,5.0,,5.0,False,False,5.0,,5.0,0,0,,1100359
19,,4.0,WRIT002,"For international students, Karen means more than just a professor. Karen is first of all a great friend that you can talk to about anything on you mind. She would be always interested to hear what you have to say. She has the capacity to connect to people from very different backgrounds and understand them.For that reason,she is a global professor",False,2008-04-08 10:46:14,3.0,,4.0,False,False,4.0,,4.0,0,0,,1100359
20,,5.0,WRIT002,"Karen is exceptional.Her classes promote an intellectual curiosity that continues to serve her students even after her class.An ideal balance between challenging texts and thoughtful discussions, the intricate structure of her class ensures that her students become proficient at communicating complex thoughts. She improved my writing significantly.",False,2008-04-08 08:43:24,4.0,,5.0,False,False,5.0,,3.0,0,0,,1100359
21,,5.0,WRIT2,Prof Karen Gocsik received &quot;The Best Teacher Award&quot; at Dartmouth College after being nominated and selected by the students themselves and I believe that she deserves wider recognition! Karen's class is a bonding experience that involves intensive learning. Her enthusiasm is contagious and the discussions are beyond the realm of a typical classroom,False,2008-04-08 08:01:39,3.0,,5.0,False,False,5.0,,5.0,0,0,,1100359
22,,5.0,WRIT2,"Best professor ever! Karen really cares about her students and helps them both in and out of class, and with life in general! She really helped me adjust to college life. My writing also improved exponentially thanks to her. I used to be afraid of writing but now I actually enjoy it. If you have a chance, take a class with her. You won't regret it!",False,2008-04-08 02:17:41,3.0,,5.0,False,False,5.0,,5.0,0,0,,1100359
23,,5.0,WRIT0203,"Karen is the most responsible and best professor that I have ever met at Dartmouth. I took my writing class for two terms in my freshman year, and it has been my part of my most precious memory at college. Not only did I learn to be good at writing academic paper, but I began to grasp the right attitude of life as an adult. Karen is the best!",False,2008-04-08 02:00:06,4.0,,5.0,False,False,5.0,,5.0,0,0,,1100359
24,,5.0,WRIT002,Prof. Karen's teaching is one of the best way to start off your College Writing Course. She gives chances for students to make innovative response during class discussion.  Improvement for writing skills after the course is almost guaranteed!,False,2008-04-08 01:53:53,4.0,,5.0,False,False,5.0,,4.0,0,0,,1100359
25,non mandatory,5.0,COSC30,"Jayanti is probably the best lecturer I have ever had. he is entertaining, on topic, likeable, and extremely patient.",False,2022-01-11 20:48:27,4.0,B+,5.0,True,False,5.0,Hilarious--Amazing lectures--Tough grader,0.0,0,0,1.0,261485
26,non mandatory,5.0,COSC10,Wonderful at explaining complicated computer science concepts and linking them to real world analogies,False,2016-05-09 22:04:18,3.0,A,4.0,True,False,5.0,,0.0,2,4,,261485
27,non mandatory,5.0,COSC30,"Best Professor I've had at Dartmouth, hands down. No matter who you take them with, CS30 is going to be tough, and CS31 is going to be tougher. However, if you do it with Jayanti, you'll enjoy yourself and you'll enjoy the class and you'll actually feel like you've learned something.",False,2015-10-25 09:21:05,3.0,A-,5.0,True,False,5.0,,1.0,0,3,,261485
28,,5.0,BHAARATASIBIRA,great interaction with students,False,2015-06-25 04:38:42,1.0,A+,5.0,False,False,5.0,,1.0,0,1,,261485
29,non mandatory,5.0,COSC30,Best prof I've had so far at dartmouth,False,2015-03-02 03:55:38,3.0,,5.0,True,False,5.0,,1.0,0,1,,261485
30,,5.0,CS30,Awesome,False,2014-10-02 15:54:53,1.0,,5.0,False,False,5.0,,4.0,0,1,,261485
31,,5.0,COSC30,"REALLY smart, but doesn't plan the answers beforehand, just has epiphanies when solving problems. It's like taking a class from God.",False,2012-02-19 11:02:42,4.0,,5.0,False,False,5.0,,3.0,0,6,,261485
32,,5.0,COSC005,Absolutely one of the best profs I've had at Dartmouth,False,2011-03-23 18:15:31,3.0,,5.0,False,False,5.0,,2.0,0,1,,261485
33,,5.0,CS25,.,False,2010-07-17 18:23:40,2.0,,5.0,False,False,5.0,,1.0,0,0,,261485
34,,5.0,COSC25,"Best professor of all time. If you have the opportunity to take a class with this dude, you better DO IT!",False,2009-11-18 16:20:12,4.0,,5.0,False,False,5.0,,5.0,0,2,,261485
35,,4.0,CS25,Great,False,2009-11-18 16:17:19,5.0,,3.0,False,False,4.0,,5.0,0,1,,261485
36,,5.0,CS25,He filled in for my professor a few times and i REALLY wish he tought the class full time.  He explained everything so clearly and was so entertainint,False,2009-09-18 14:07:49,3.0,,5.0,False,False,5.0,,3.0,0,2,,261485
37,,5.0,CS49,"After years of classes, the best professor I have had for any course.",False,2006-04-18 16:36:25,3.0,,5.0,False,False,5.0,,,0,1,,261485
38,,5.0,CS49,The greatest professor in the history of the universe.,False,2004-09-06 01:39:49,5.0,,5.0,False,False,5.0,,,0,0,,261485
39,,4.0,CS49,No Comments,False,2004-07-07 11:00:30,3.0,,4.0,False,False,4.0,,,0,0,,261485
40,,4.0,CS4,prasad is one funky dude.,False,2003-10-21 17:29:49,2.0,,4.0,False,False,4.0,,,0,0,,261485
41,,5.0,COSC49,No Comments,False,2003-10-14 20:36:07,3.0,,5.0,False,False,5.0,,,1,0,,261485
42,,5.0,CS49,This dude has one sweet accent.,False,2003-10-14 20:33:52,1.0,,5.0,False,False,5.0,,,0,0,,261485
43,mandatory,5.0,ECON26,Amazing prof. Makes you think,False,2018-08-24 22:34:27,4.0,,5.0,True,False,5.0,Participation matters--Skip class? You won't pass.--LOTS OF HOMEWORK,5.0,0,1,1.0,741913
44,mandatory,5.0,ECON26,"This guy is a genius. Most eye-opening class I've ever taken.  It takes 6 hours of preparation for each class, but completely worth it, because it's really interesting stuff.",False,2015-09-26 11:31:04,4.0,A,4.0,True,False,5.0,,5.0,0,1,,741913
45,,5.0,ECON26,If you get an A in Econ 26 you are respected by all the alumni network.,False,2015-02-17 01:29:38,1.0,,5.0,True,False,5.0,,5.0,1,3,,741913
46,,4.0,ECON026,One of the toughest classes I've ever taken. Not conceptually difficult but it covers a lot of material. First class I've ever read the entire textbook for. The class (socratic method)structure forces you to learn the material well. Definetly the class I've learned the most in.,False,2014-08-21 15:00:29,5.0,,5.0,False,False,5.0,,5.0,0,0,,741913
47,,4.0,ECON026,Great professor who holds his students to a very high level. The class was very difficult but I really enjoyed it.,False,2013-05-25 00:45:16,5.0,,2.0,False,False,3.0,,5.0,0,0,,741913
48,,3.0,ECON26,He's really hard but you'll learn a lot.,False,2010-11-14 00:28:14,5.0,,3.0,False,False,3.0,,3.0,0,1,,741913
49,,3.0,ECON26,Practice exams and memorize his book.,False,2010-06-23 22:56:49,4.0,,1.0,False,False,2.0,,5.0,1,0,,741913
50,,4.0,ECONECON,"Some students will be well advised not to watch Super bowl when it's review time. Don't blame your professor for your poor performance and bad grades. The word is &quot;awful,&quot; not &quot;aweful.&quot; And it is &quot;nightmare,&quot; not &quot;nitemare.&quot; This professor is very knowledgeable. Hard work pays off though.",False,2010-02-21 20:29:24,5.0,,4.0,False,False,4.0,,4.0,0,0,,741913
51,,5.0,ECON101,Excellent Professor,False,2009-02-11 14:41:26,3.0,,5.0,False,False,5.0,,4.0,0,1,,741913
52,,1.0,ECON26,"This guy sucks! He holds office hours as early as possible to minimize the number of visits. He does absolutely NO teaching in class. The class consists of randomly selecting students to answer the questions from the textbook. And then you're graded on it. This is NOT a business school format, where there is actual discussion. There's more...",False,2007-01-18 16:28:54,4.0,,1.0,False,False,1.0,,5.0,1,2,,741913
53,,2.0,ECON26,"Kohn isn't a great instructor, but the class format is good because it forces you to learn it on your own.  Like law school format where he calls on you randomly to answer questions.  But after taking the class and being a study group leader for the class I think even I could do a better job of explaining the concepts.",False,2006-12-27 22:02:51,5.0,,3.0,False,False,3.0,,4.0,0,1,,741913
54,,1.0,ECON35,Aweful!!! The only reason I took this class was to get rid of the requirement and the professor made a bad class into a nitemare. Teaching = crap; attitude = crap. I hear dude was in the Israeli army; I wouldn't be surprised if he'd killed someone with his own hands.,False,2006-09-09 18:19:45,5.0,,1.0,False,False,1.0,,4.0,3,0,,741913
55,,1.0,ECON,To call this **** a jerk is an insult to all the honest jerks out there. He's lunatic. He delibrately misguided the class on a test and seemed to really get a big kick out of it.,False,2006-07-13 18:26:46,1.0,,1.0,False,False,1.0,,,0,1,,741913
56,,2.0,ECON,yeah - he is a bit of a jerk.  Teaches his class like B-school.  My favorite Kohn story is that he scheduled a review during the super-bowl.,False,2006-06-28 21:04:09,5.0,,1.0,False,False,2.0,,,1,1,,741913
57,,1.0,ECON,No Comments,False,2006-04-14 18:37:10,5.0,,1.0,False,False,1.0,,,1,0,,741913
58,,3.0,ANTH21,"She really cares about her students and is often open outside of class to help. She really is an amazing person. However, her lectures are fast and heavy and tend not to be very engaging. Reading the class materials is an essential, because you will definitely miss some of the information given in her lectures.",False,2017-02-12 14:59:58,2.0,B+,3.0,True,False,3.0,Get ready to read--ACCESSIBLE OUTSIDE CLASS--LECTURE HEAVY,5.0,0,0,0.0,282419
59,,2.0,ANTH008,Classes are heavy on lecture and are not very engaging. One of the worse classes I have taken.,False,2011-03-21 01:16:54,4.0,,2.0,False,False,2.0,,5.0,0,0,,282419
60,,5.0,ANTH22,Passionate professor. Really knows her stuff.,False,2010-09-10 16:24:30,2.0,,5.0,False,False,5.0,,4.0,0,1,,282419
61,,4.0,ANTH21,She's awesome!  She's so helpful and really cares about you.  If you express an interest in archaeology she'll take you under her wing and really help you out!,False,2009-06-23 23:30:45,4.0,,1.0,False,False,3.0,,3.0,0,0,,282419
62,,1.0,ANTH8,The prof. totaly blew it. By the end of the term more than 3/4 of students were sick and tired of both the topic and her attitude. Not recommended...,False,2008-04-06 20:22:52,5.0,,1.0,False,False,1.0,,2.0,2,1,,282419
63,,1.0,ANTH8,"The most boring and dull class ever. How can Nichols take an interesting topic like archeology and turn it into this crap is beyond my comprehension. On a personal note, I find her to be a jerk. She acts as if she's interested in having interaction with students, but she wants to kick you out 5 minutes after you step  into her office...not good...",False,2008-04-05 22:45:36,5.0,,1.0,False,False,1.0,,3.0,2,1,,282419
64,,1.0,ANTH5,"Aweful class, boring lectures, Nichols sucks big time...",False,2008-04-05 16:17:28,4.0,,1.0,False,False,1.0,,3.0,1,1,,282419
65,,1.0,ANTH8,"This was perhaps the worst class I had in my four years at Dartmouth. I've never seen a more annoying professor than Deborah Nichols. She's boring, self-absorbed, and couldn't care less if the material made sense to students. I did get a good grade, but I hated the class, Nichols, and archaeology...",False,2008-03-18 22:27:40,5.0,,1.0,False,False,1.0,,4.0,1,1,,282419
66,,3.0,ANTH33,"I had her for Archaeology of Prehispanic Mesoamerica in the mid 90s. She was, by far, the most boring professor I had at Dartmouth. Staying awake was a struggle.",False,2007-08-16 13:11:26,3.0,,1.0,False,False,2.0,,3.0,1,1,,282419
67,Y,4.0,ANTH,"Nichols has great energy and really knows her stuff.  She talks fast and communicates a tremendous amount in her lectures.  Dry&#63;  Not if you pay attention and stay with her.  She is very personable and enthusiastic about teaching, will go out of her way to support student research interests.",False,2004-12-21 13:48:46,3.0,C,5.0,False,False,5.0,,,0,0,,282419
68,,3.0,ANTHRO8,dry lecture style,False,2003-11-11 13:59:47,3.0,,3.0,False,False,3.0,,,0,0,,282419
69,,5.0,HIST202,Really goooood,False,2008-09-01 18:27:01,1.0,,5.0,False,False,5.0,,5.0,1,0,,312215
70,,1.0,NEURO000,No Comments,False,2008-04-08 13:26:44,5.0,,1.0,False,False,1.0,,1.0,0,0,,312215
71,,1.0,PSYCH1,"In his own words, he drinks 7 caffeinated soft drinks before 10 in the morning!  He has very little attention span for anything to do with students. He just reads his powerpoint slides but if a student has a question he gets confused and can't answer.  His section of psych 1: super boring.  All the other profs teaching it were great though.",False,2007-03-09 09:49:48,1.0,,1.0,False,False,1.0,,5.0,0,3,,312215
72,,1.0,PSYCH,"The most boring class I ever had at Dartmouth by far. He just clicks through countless powerpoint presentations and drones on. Doesn't answer questions clearly. Rude to students who ask questions. Oh and is just me, or does the comment beginning with &quot;Dr. Cohen&quot; sound like it was written by him.",False,2006-09-05 11:30:52,4.0,,1.0,False,False,1.0,,1.0,0,3,,312215
73,,1.0,NEUROSCIENCE,"HORRIBLE! Run! Unless you actually enjoy 5 unmitigated hours of PowerPoint slides a week do NOT take a class with this guy. Far more interested in personal, esoteric research than actually teaching.",False,2006-03-16 23:02:20,4.0,,1.0,False,False,1.0,,,0,2,,312215
74,,4.0,PSYCH06,"Dr. Cohen represents the best of Dartmouth.  His enthusiasm for neuroscience is infectious and he proved to have a nearly inexhaustible patience in helping me to understand some very difficult subject matter.  He's also a nice guy. The class is hard if you don’t keep up with the reading, but at least I actually learning something worth knowing.",False,2005-09-29 10:59:31,3.0,,5.0,False,False,5.0,,,0,0,,312215
75,,1.0,PSYC6,Yale Cohen is a moron.  He killed my enthusiasm for Neuroscience and was a terrible teacher.,False,2004-12-06 20:07:22,4.0,,1.0,False,False,1.0,,,0,0,,312215
76,,5.0,PYSCH6,No Comments,False,2004-11-22 11:40:25,3.0,,5.0,False,False,5.0,,,0,0,,312215
77,,4.0,PSYCH6,No Comments,False,2004-01-05 20:04:40,3.0,,5.0,False,False,5.0,,,0,0,,312215
78,,4.0,PSYCH06,No Comments,False,2003-12-06 18:12:58,3.0,,5.0,False,False,5.0,,,0,0,,312215
79,non mandatory,5.0,ENGL42,"I've never had a professor more passionate about his subject!  This is a case where even if you're not interested in the subject, you should take the class because the professor is so gifted!!!",False,2022-07-26 19:17:09,5.0,A-,5.0,True,False,5.0,,3.0,0,0,1.0,264228
80,non mandatory,5.0,MALS101,I took two classes with Prof Pease while earning my MA at Dartmouth and highly recommend students take any class he offers. He was always available during his office hours and any other time that I was able to schedule. He was by far the best professor I had at Dartmouth which is quite remarkable because the professors there are exceptional.,False,2021-12-31 16:38:34,3.0,A+,5.0,True,False,5.0,Accessible outside class--Get ready to read--Lecture heavy,0.0,0,0,1.0,264228
81,,5.0,AMERICANDREAM,"Dr. Donald Pease is to me, as Edward Said is to him. Worlds best.........",False,2014-03-27 10:54:52,4.0,A+,5.0,False,False,5.0,,5.0,0,1,,264228
82,,5.0,ENGL42,"I feel very fortunate to have taken two classes with Professor Pease. His lectures are both entertaining and insightful, and I still think of them often, three years after graduating.",False,2011-05-05 11:12:38,2.0,,5.0,False,False,5.0,,2.0,0,0,,264228
83,,5.0,ENGL42,Awesome professor!,False,2008-08-19 08:22:42,1.0,,5.0,False,False,5.0,,5.0,0,0,,264228
84,,2.0,ENGLISH4563,One of my favorite professors ever.  Can be hard to follow sometimes but that's only because he knows so much and cares so much about the works he is discussing he has a hard time getting out evrything he wants to say.,False,2006-02-24 13:31:57,2.0,,5.0,False,False,4.0,,,0,0,,264228
85,,1.0,MALS,Is far more interested in showing off his knowledge than helping students understand the subject. A reputation as an intellectual bully that is not completely undeserved.,False,2005-08-25 09:58:57,4.0,,1.0,False,False,1.0,,,0,3,,264228
86,,2.0,58,No Comments,False,2005-06-02 15:28:53,4.0,,1.0,False,False,2.0,,,0,0,,264228
87,,3.0,AMPOETRY,"Brilliant at times, but needs to outline his lectures. Sometimes didn't even refer to the poetry we had read. There's no doubt, however, about his enthusiasm and his intellectual power (both enormous).",False,2003-11-22 00:09:37,4.0,,3.0,False,False,3.0,,,0,0,,264228
88,,1.0,MALS,No Comments,False,2003-10-19 22:38:35,2.0,,4.0,False,False,3.0,,,0,0,,264228
89,non mandatory,1.0,COSC11,"Lectures are okay, but his exams are pretty unfair and doesn't give any heads up on what you actually need to know. Gives some practice problems that are 1/10th the difficulty of the actual exams. Will teach a subject, then expect you to expand your learning-- on the exam.",False,2019-05-11 16:28:29,3.0,A-,1.0,True,False,1.0,Test heavy--Tough grader,0.0,0,0,0.0,1742121
90,non mandatory,1.0,CS174,"A very mean prof, and you need to be careful about everything.",False,2017-06-20 03:28:22,1.0,C,1.0,False,True,1.0,Tough Grader--LOTS OF HOMEWORK--TEST HEAVY,0.0,0,0,0.0,1742121
91,non mandatory,1.0,CS174,Useless class. Save yourself some time and learn everything you need about ML from online lectures.,False,2016-11-18 14:22:48,3.0,,1.0,True,False,1.0,,0.0,0,0,0.0,1742121
92,non mandatory,5.0,CS174,"Well-prepared lectures, project is where the most interesting to do while learning machine learning models.",False,2016-03-29 22:11:24,1.0,A+,5.0,True,False,5.0,,1.0,0,0,,1742121
93,,5.0,COSC74,"ML is a very interesting subject. The lectures are well-organized and well-delivered. The exams can be a bit challenging. Overall, it was a pleasant experience.",False,2014-03-24 13:16:09,3.0,,5.0,True,True,5.0,,1.0,0,1,,1742121
94,,4.0,CS174,The lecture is overall OK. Pronunciation is clear. He is a strict and rigid. He don't  even allow a different form of answer in the homework.,False,2014-02-07 21:36:56,2.0,,1.0,False,False,3.0,,2.0,0,0,,1742121
95,Y,5.0,CS174,The lectures are easy to follow. Not much using textbook. 3 Homework requires both programming (MATLAB) and theory questions. The project is fun and I learning a lot via doing it which is my own proposed problem using machine learning models.,False,2013-10-24 00:07:39,1.0,Not_Sure_Yet,4.0,False,False,5.0,,2.0,0,0,,1742121
96,,1.0,COSCML,Avoid if possible. The lecture is not well prepared and you will find he always use the word 'exactly' to answer your questions.,False,2013-08-08 23:10:32,4.0,,1.0,False,False,1.0,,1.0,0,0,,1742121
97,,2.0,COSC183,prepare your excuse to skip the class. Boring....,False,2012-12-01 20:43:42,3.0,,2.0,False,False,2.0,,1.0,0,0,,1742121
98,mandatory,2.0,ENGL15,"Luxon is a nice person, but not the greatest professor for Shakespeare. We were expected to post our questions online about each reading; he would select some of these posts to discuss in class the next day. During class, he just elaborated on our comments (very little lecture), so our learning felt scattered and too detail-oriented. But easy A.",False,2016-02-03 18:27:25,2.0,A,3.0,True,False,3.0,,4.0,0,0,,423774
