index,attendance_mandatory,clarity_rating,class,comment,created_by_user,date,difficulty_rating,grade,helpful_rating,is_for_credit,is_for_online_class,quality_rating,rating_tags,textbook_use,thumbs_down_total,thumbs_up_total,would_take_again,pid
205,,1.0,ANTH003,Alverson is the worst prof I have ever had at Dartmouth. He purposely used superfluous language to make himself feel superior. The tests had little to do with lectures or readings. It is surprising this man is an anthropology prof given his extremely low emotional intelligence. This low E.I. makes him a horrible teacher for anyone trying to learn.,False,2007-08-16 11:57:42,4.0,,1.0,False,False,1.0,,2.0,0,0,,597683
206,,5.0,CULTURALANTH,Also had him for African Experience and Language and Culture,False,2005-09-04 22:40:56,5.0,,5.0,False,False,5.0,,,0,0,,597683
207,,1.0,ANTHRO03,Couldn't answer his short answer tests the way he wanted and paid for it.,False,2005-05-17 23:07:25,3.0,,2.0,False,False,2.0,,,0,0,,597683
208,,3.0,ANTH3,"This is one of those crappy professors that makes you buy the book that he wrote because he wrote it.  Not only that, he makes you buy the book by his wife...about him.  If you want a nap, take this class.  The egomaniac never failed to put me to sleep.",False,2005-04-14 15:48:10,2.0,,1.0,False,False,2.0,,,0,0,,597683
209,,5.0,ENGL85,"Very helpful/understanding for students, has great advice and exercises for learning.",False,2012-02-19 10:59:44,3.0,,4.0,False,False,5.0,,2.0,0,0,,770515
210,,5.0,ENGL81,"REALLY good feedback, very understanding. I love having her look at my work and I've learned a lot about being a writer in this class. Don't take her comments personally (you can't in any CW class) because she's trying to help you learn, and explains concepts way more effectively than most other CW profs.",False,2012-02-19 10:58:37,4.0,,5.0,False,False,5.0,,2.0,0,0,,770515
211,,5.0,CREATIVEWRITIN,Very dedicated to helping her students. Very knowledgeble about the subject matter.,False,2006-05-05 12:18:14,3.0,,5.0,False,False,5.0,,,0,1,,770515
212,,2.0,CREATIVEWRITIN,Totally self involved,False,2006-04-27 15:08:29,1.0,,2.0,False,False,2.0,,,0,0,,770515
213,,5.0,ENG101,Best prof at Dartmough.,False,2005-12-03 14:38:56,3.0,,5.0,False,False,5.0,,,0,0,,770515
214,,5.0,FRENCH,"Professor LaGuardia is easily the most brilliant professor in the entire French and Italian Department. Although French fluency among students range from native to beginner's, he can masterfully conduct a class that engages everyone. He's perspicacious, intellectual, yet relaxed, and doesn't have OCD like others. He's generous, caring, brilliant.",False,2013-11-25 06:17:58,4.0,,5.0,False,False,5.0,,3.0,0,0,,628977
215,,4.0,FRENC30,"Please, one of the best profs at Dartmouth&#63; This guy doesn't even know what he's talking about! He extrapolates some half baked theories based on some articles he's read, and when you point out the flaws in his arguments he just cannot let it go.  Not smart.  Nice enough guy.  Also a snob",False,2009-11-23 11:31:16,2.0,,3.0,False,False,4.0,,1.0,0,0,,628977
216,,2.0,COLT072,Not exactly the best professor at Dartmouth. Take any theory course with him and you'll see.,False,2007-12-01 01:41:39,2.0,,3.0,False,False,3.0,,5.0,0,0,,628977
217,,5.0,FRENCH30,No Comments,False,2005-09-15 00:21:52,3.0,,4.0,False,False,5.0,,,1,0,,628977
218,,5.0,FRENCH,"Great Guy, totally laid back and brilliant. His lectures always seem to fly by and he thoughtfully considers students' input. One of the best profs at Dartmouth. If you have a chance to go to France on one of the FSP or LSA programs with him, definitely do it.",False,2005-06-03 21:37:43,3.0,,5.0,False,False,5.0,,,0,0,,628977
219,mandatory,5.0,WRIT5,"When you are in Professor Grushina's class, you suddenly understand why you are at an Ivy League school. She genuinely wants the best for every single student, and she cares about each individual past the classroom. The environment she is able to create in her classroom is truly special, and I haven't seen that done in any other class before. ",False,2023-11-10 17:03:34,3.0,A,5.0,False,False,5.0,Clear grading criteria--Gives good feedback--Respected,-1.0,0,0,1.0,2637450
220,mandatory,5.0,WRIT5,"This is for Speech class. Prof. Grushina's teaching style is great, she is motivating and gives thorough specific feedback. It's clear she wants the best for each student. Super supportive. She's so knowledgeable but doesn't overpower the class. I learned a ton about communication and went from hating to speak up to being so much more confident! ",False,2022-12-15 01:02:33,3.0,A-,5.0,True,False,5.0,Gives good feedback--Caring--Respected,-1.0,0,0,1.0,2637450
221,mandatory,5.0,WRIT5,"Prof Grushina is a fantastic professor. She is always available to meet and genuinely cares about every student. Class discussions were always interesting, I made great friends in that class. One-on-one conferences were hugely beneficial. Lots of work, and she makes a ton of comments on drafts but if you work hard, you'll learn a lot and get an A.",False,2020-12-31 00:45:33,4.0,A,5.0,True,False,5.0,Gives good feedback--Accessible outside class--Inspirational,0.0,0,0,1.0,2637450
222,mandatory,5.0,WRIT5,"Absolutely outstanding prof. Inspired me to go on living in this pandemic and to become a better person, let alone a better writer. Who knew the Ivy League is actually worth it, wow. I had good hs teachers but Prof. Grushina's level of knowledge and degree of caring are really next level. Detailed feedback in person and canvas. Loved the collage!!",False,2020-12-08 20:45:36,4.0,A,5.0,True,False,5.0,Gives good feedback--Accessible outside class--Inspirational,5.0,0,0,1.0,2637450
223,mandatory,2.0,WRIT5,Extremely dull lecturer. Had a hard time staying awake in her classes.,False,2020-11-13 13:17:05,2.0,A,2.0,True,False,2.0,Clear grading criteria,0.0,0,0,0.0,2637450
224,,5.0,CHEM064,Loved Inorganic with Glueck! The labs were amazing too,False,2012-08-03 02:46:04,1.0,,5.0,False,False,5.0,,5.0,0,1,,265513
225,,2.0,CHEM64,"While clearly a brilliant chemist, his lectures are rather monotanous and his monotone voice does not help the student know what is important to the class. I found his classes difficult as his tests are truly monsters. His Chem 6 class is good but definetly harder than others. His 64 class is hard, filled with premeds and majors.",False,2008-05-08 13:59:58,5.0,,3.0,False,False,3.0,,5.0,1,0,,265513
226,,3.0,CHEMISTRY6,"I found his teaching style very bland and uninteresting.  All he did was lecture and his jokes were not funny. His lectures were confusing and overwhelming, however, he did help me when I went to office hours.  His tests are RIDICULOUS!!!!!  There is no reason why his tests should be that hard because the homeworks are not even that hard!  Boo!",False,2005-08-15 13:09:10,4.0,,3.0,False,False,3.0,,,1,0,,265513
227,,5.0,CHEM6,Very funny guy and extremely organized.  He makes the material very easy to understand.  Highly recommend his class.,False,2004-03-13 00:44:07,3.0,,5.0,False,False,5.0,,,0,0,,265513
228,,5.0,CHEM664,Clear and helpful.  Also HOT!,False,2003-10-21 21:04:10,1.0,,5.0,False,False,5.0,,,0,0,,265513
229,mandatory,5.0,PHY101,Inspirational! ,False,2015-08-30 05:17:11,1.0,,5.0,True,False,5.0,,3.0,0,0,,721755
230,,4.0,PHYS016,"Funny and really smart. E&M is boring, but Marcelo made the class interesting.",False,2013-02-11 15:42:07,3.0,,4.0,False,False,4.0,,2.0,0,0,,721755
231,,2.0,ASTROPHYS,"Even for the low teaching standards at Dartmouth, Gleiser is a marginal instructor. He seems to think to be a novel Einstein, and teaches accordingly.",False,2007-12-27 18:19:09,2.0,,1.0,False,False,2.0,,2.0,1,1,,721755
232,,1.0,ADVANCEDQM,"Gleiser is an incoherent lecturer, an unfair grader, and not helpful outside of class. He is also extremely full of himself.",False,2006-05-08 15:51:19,4.0,,1.0,False,False,1.0,,,1,1,,721755
233,Y,5.0,ADVANCEDQM,"Gleiser is an excellent teacher, and occasionally funny too.",False,2005-11-20 21:10:48,3.0,C-,5.0,False,False,5.0,,,0,0,,721755
234,,3.0,ENGLISH38,"Lots of awkward silences because she never seemed to prepare lectures.  She's also the only prof I've ever had who used students' personal analyses in her few lectures, taking the credit for herself.  Least ethical prof I've ever had.  If you do have her -- you get the highest essay grades for regurgitating material.",False,2013-11-11 22:07:37,3.0,,1.0,False,False,2.0,,3.0,0,1,,312219
235,,4.0,ENG5,No Comments,False,2007-07-22 22:22:39,3.0,,3.0,False,False,4.0,,1.0,0,0,,312219
236,,5.0,ENG72,Professor McKee is really smart and really helpful at the same time.  She really cares about her students and is very sincere.,False,2006-05-12 11:38:07,3.0,,5.0,False,False,5.0,,,0,0,,312219
237,,4.0,ENGL05,No Comments,False,2003-12-06 18:14:11,3.0,,5.0,False,False,5.0,,,0,0,,312219
238,Y,4.0,CHEM52,"Wu teaches Chem 52 and he is a great professor, but the material is extremely difficult and he sometimes rushes thorough the material, still expecting you to understand it on exams.",False,2014-01-05 16:28:33,5.0,B,5.0,False,False,5.0,,5.0,0,0,,1293385
239,,2.0,LAB247,Do not work for this guy.  He sucks.,False,2012-06-03 15:40:24,3.0,,2.0,False,False,2.0,,2.0,2,0,,1293385
240,,5.0,CHEM58,Awesome professor. Extremely helpful. Crystal clear. Super nice guy.,False,2010-12-09 09:25:51,4.0,,5.0,False,False,5.0,,1.0,0,0,,1293385
241,,5.0,CHEM52,He's just awesome.,False,2009-06-05 14:21:14,4.0,,5.0,False,False,5.0,,2.0,0,0,,1293385
242,mandatory,5.0,CHEM81,"Great guy with a wonderful teaching style. Prefers the use of the board for lectures, which is a very refreshing change from staring at PowerPoints all day. The textbook is pretty useless, but he is easily accessible and can answer questions.",False,2022-02-10 04:51:31,3.0,A,5.0,True,False,5.0,Accessible outside class--Skip class? You won't pass.--Caring,5.0,0,0,1.0,265517
243,Y,3.0,CHEM005,"Professor Winn is extremely nice and helpful, uses the chalk board a lot rather than slideshows which I found to be a refreshing change from the norm. The material in chem 5 is very difficult though.",False,2014-01-05 16:33:23,5.0,B,4.0,False,False,4.0,,5.0,0,1,,265517
244,,1.0,CHEM81,"He is lame to do research, that is why he tries to pretend to be nice to gain the favor of unders.",False,2005-12-30 01:07:58,5.0,,1.0,False,False,1.0,,,1,0,,265517
245,,5.0,CHEM81,Very nice and a good teacher.  Much more helpful than his book.,False,2003-10-21 21:08:12,1.0,,5.0,False,False,5.0,,,0,0,,265517
246,,1.0,ANTH036,I would never suggest to anyone that they take a class with Professor Eickelman. He's a poor professor who thinks far too highly of himself. His lectures were the worst part of my Dartmouth experience.,False,2013-05-25 00:41:14,4.0,,1.0,False,False,1.0,,1.0,0,0,,1111590
247,,1.0,ANTHX,No Comments,False,2008-04-05 22:47:32,5.0,,1.0,False,False,1.0,,1.0,0,0,,1111590
248,,1.0,ANTH33,"Amen brother...not just an aweful professor, but an obnoxious human being. KICK HIM OUT RIGHT NOW!!!",False,2008-04-05 16:24:12,5.0,,1.0,False,False,1.0,,1.0,0,0,,1111590
249,,1.0,ANTHX,"The most pompous, arrogant SOB on the face of the planet. Treats students like****. Eickelman should be fired and tried for crimes against humanity!",False,2008-03-18 22:37:02,5.0,,1.0,False,False,1.0,,1.0,0,0,,1111590
250,,2.0,ENGS23,He is so hard and his book is not good at all.,False,2013-03-07 11:18:33,5.0,,4.0,False,False,3.0,,5.0,0,1,,1169018
251,,4.0,ENGS47,I struggled so hard in this class but Prof. Hansen was always there to help me/my partner out. He's really nice (very sweet) and really cares about doing the best for his students.,False,2012-02-19 11:00:58,4.0,,5.0,False,False,5.0,,3.0,0,0,,1169018
252,,4.0,ENGS92,I have the highest regards and respect for Professor Hansen. He wrote the classroom text and teaches with the highest degrees of ethics and attention to detail.,False,2010-03-10 01:10:08,3.0,,5.0,False,False,5.0,,4.0,0,0,,1169018
253,,4.0,ENGS23,No Comments,False,2008-08-22 11:08:39,5.0,,5.0,False,False,5.0,,5.0,0,0,,1169018
254,,5.0,CHEM52,"One of my favorite professors, hands down",False,2019-03-21 05:29:59,4.0,,5.0,True,False,5.0,Respected--Amazing lectures--Caring,5.0,0,0,1.0,1507530
255,,5.0,CHEM058,Gribble's the man,False,2012-08-03 02:43:36,1.0,,5.0,False,False,5.0,,5.0,0,1,,1507530
256,,5.0,CHEM93,Organic chemistry isn't my favorite subject but Professor Gribble is just a fantastic person.  Very knowledgeable and interesting.,False,2012-03-01 11:36:01,3.0,,5.0,False,False,5.0,,1.0,0,1,,1507530
257,,5.0,CHEM51,Great professor! really helpful and nice. made the material really interesting.,False,2010-12-09 09:28:28,4.0,,5.0,False,False,5.0,,1.0,0,4,,1507530
258,non mandatory,5.0,PHYS043,Shes so kind so helpful and so smart!! Helped me understand a lot.,False,2021-11-28 00:55:42,4.0,B+,5.0,True,False,5.0,Gives good feedback--Accessible outside class--Skip class? You won't pass.,5.0,0,0,1.0,1504546
259,mandatory,4.0,PHYS015,"Not a difficult class, but Milan teacher special relativity and quantum mechanics very well. Also teaches to each student.",False,2018-01-09 20:56:27,3.0,A,4.0,True,False,4.0,Gives good feedback--Respected--Participation matters,5.0,0,0,1.0,1504546
260,,4.0,PHYS015,Interesting lectures. Very lenient grader.,False,2012-11-17 17:08:19,3.0,,4.0,False,False,4.0,,2.0,0,0,,1504546
261,,3.0,PHYS3,"Pedantic instructor, difficult to understand how she could be in an Ivy institution.",False,2010-12-03 20:45:49,1.0,,2.0,False,False,3.0,,3.0,1,0,,1504546
262,mandatory,5.0,GEOG42,"In my experience, Fox is one of the best professors at Dartmouth. All of her geography classes are fascinating, and nearly every student majoring in geography has amazing things to say about her. Would recommend to any student who loves an engaging lecturer and is ok with lots of reading",False,2021-04-02 12:59:29,3.0,A,5.0,True,True,5.0,Accessible outside class--Get ready to read--Amazing lectures,0.0,0,0,1.0,1550811
263,mandatory,4.0,GEOG013,"I did not like her teaching style or the way in which she did her lectures, but I will say that she is extremely understanding. One time, I spoke in a paper about me coming to terms with my sexuality, and she had my back all the way, and even sympathized with me! That's how you know she will do anything for her students.",False,2021-03-28 00:44:00,4.0,B,4.0,False,False,4.0,Lots of homework--Caring--Tough grader,0.0,0,0,0.0,1550811
264,mandatory,4.0,GEOG02,"Prof. Fox is an extremely engaging lecturer and is very easy to talk to, though her courses assign an extremely heavy amount of reading and there are significant writing assignments due every week. Definitely not an easy grader. That being said, I loved her class.",False,2020-11-13 13:11:56,4.0,A-,4.0,True,True,4.0,Lots of homework--Clear grading criteria--Amazing lectures,0.0,0,0,1.0,1550811
265,,5.0,GEOGSEAS,Very interesting!  Charming and piqued my interest in the region,False,2012-08-30 16:14:28,2.0,,4.0,False,False,5.0,,2.0,1,0,,1550811
266,Y,5.0,PSYC007,The most helpful teacher/professor I have  ever had for writing.  I have grown so much as a writer through his freshman seminar.  I highly recommend going in to talk with him often as his comments into writing are both insightful and informative.,False,2014-02-11 09:55:12,2.0,,5.0,False,False,5.0,,5.0,0,0,,24789
267,,5.0,PSYCH10,"He really cares about his students and you can tell he is passionate about the subject. I thought his jokes were funny and he tries very hard. Office hours were always helpful and he explains things very well and never makes you feel like you asked a stupid question. Good class, fantastic professor, decent amount of reading, average tests.",False,2012-02-29 22:04:51,2.0,,5.0,False,False,5.0,,5.0,0,0,,24789
268,,5.0,PSYC10,"I really didn't want to take stats, but this guy made it fun.  He may be the best professor I've ever had.  Really cares about his students and his subject.",False,2008-08-18 19:19:40,3.0,,5.0,False,False,5.0,,3.0,1,1,,24789
269,non mandatory,5.0,PHYS14,"Labelle is awesome. I rarely rate my professors, but felt the need to give credit where it was due. He is so enthusiastic, and excited about what he teaches, and does a fantastic job of explaining things.",False,2015-05-20 22:03:37,1.0,,5.0,True,False,5.0,,4.0,0,0,,1173171
270,,5.0,P14,"omg. LaBelle is such a character. By far one of the best physics profs at Dartmouth. If you ever take physics here, make sure he's teaching it!!!!",False,2013-05-27 23:24:51,2.0,,5.0,False,False,5.0,,3.0,0,0,,1173171
271,,5.0,PHYS13,great prof but tests are awful,False,2012-05-03 03:43:28,3.0,,4.0,False,False,5.0,,1.0,0,0,,1173171
272,,3.0,CS10,Lol oh gevorg. Good thing all the notes are online.,False,2013-12-06 19:15:31,1.0,,3.0,False,False,3.0,,3.0,1,2,,1826310
273,Y,1.0,COS186,Seriously he can't explain things well. He expects you to know everything of what he is teaching.,False,2013-08-25 12:48:24,4.0,,1.0,False,False,1.0,,1.0,2,2,,1826310
274,,2.0,COS189,"Can't figure out why a biology course was set in CS department. All your classmates will be from bio dept. Be careful CS dude, if you don't have strong bio background, then don't go for it.",False,2013-07-01 03:11:25,5.0,,1.0,False,False,2.0,,1.0,2,6,,1826310
275,mandatory,1.0,COSC59,Lectures are super fast and not useful.  You end up teaching yourself for the entire course.,False,2022-11-10 22:46:49,5.0,Drop/Withdrawal,1.0,True,False,1.0,Tough grader--Get ready to read--Test heavy,3.0,0,0,,2616884
276,non mandatory,1.0,COSC59,He basically does not teach at all. He just run through his slides and that would take up your time to teach your yourself outside the classroom. His lecture is really terrible and less than half the class can actually understand it. His test look nothing like homework and he made it so difficult. (CSCI 2011),False,2022-10-09 22:38:40,5.0,C+,1.0,True,False,1.0,Tough grader--Lots of homework--Test heavy,3.0,0,0,,2616884
277,non mandatory,1.0,COSC59,"Joosten does not teach. 90% of our lectures are him sharing his screen and just coding in languages that none of us know. Nobody asks questions because everyone is too lost to even know what to ask. The assignments are ridiculous, and he provides almost no guidance whatsoever. Everyone in the class spends 20-30 hours per week doing assignments. Fml",False,2021-08-04 18:17:24,5.0,,1.0,True,True,1.0,Lots of homework,0.0,0,0,0.0,2616884
278,non mandatory,5.0,ENGS130,"This is one of the hardest classes if not the hardest I have ever taken. That being said, I enjoyed every second of it and felt like I'd never learned this much in a short span of time in my life. His lectures are dense and pre-printed. You have to ask questions as they come up to keep up with the pace of the class. 100% go to office hours",False,2024-01-13 21:10:32,4.0,A+,5.0,True,False,5.0,Inspirational--Lots of homework--Lecture heavy,3.0,0,0,1.0,29928
279,,1.0,ENGS130,"Good person, fun class, beware of the time commitment",False,2011-12-13 23:14:22,4.0,,3.0,False,False,2.0,,2.0,0,0,,29928
280,,3.0,MATERIALS,Professor Schulson knowns his material but is one of the worst professor I have ever encountered.  Feel free to ask around as to whether or not to take his class...I'm sure most students will agree not to.,False,2005-06-16 10:41:22,3.0,,1.0,False,False,2.0,,,0,0,,29928
281,mandatory,1.0,ITAL03,"Awful, awful professor. Not accommodating, micromanaging (looks at students dates and downloads of texts), and just completely unfair. Picks on students and doesn't really want to help anyone succeed.",False,2022-08-08 14:47:15,5.0,Rather not say,1.0,True,True,1.0,Tough grader--Graded by few things,3.0,0,0,,1879648
282,,5.0,ITAL03,Best professor I've ever had.  Learning from her is a must.,False,2014-11-17 16:30:41,2.0,,5.0,True,False,5.0,,4.0,0,1,,1879648
283,Y,5.0,ITAL001,"Best professor I have had at Dartmouth.  Extremely helpful and not too difficult a grader; however, the grades are not the most important part because you learn so much in her class.  She is very engaging and makes a 9L so enjoyable.",False,2014-02-11 09:52:34,2.0,Not_Sure_Yet,5.0,False,False,5.0,,4.0,0,1,,1879648
284,,3.0,ENGL51,"Very condescending, talked down to students a lot. Really smart woman, but was not a great professor. ",False,2015-04-19 23:01:15,4.0,A+,1.0,True,False,2.0,,4.0,0,1,,691635
285,,5.0,ENG675,"One of the best professors I've had.  Clear, informative, interesting, and genuinely cares about her students.",False,2013-02-03 21:58:08,3.0,,5.0,False,False,5.0,,5.0,1,0,,691635
286,,5.0,WRIT005,Really good professor. Made my writing much better,False,2012-11-17 17:07:05,4.0,,5.0,False,False,5.0,,3.0,1,0,,691635
287,mandatory,5.0,SOCY69,Professor Campbell's classes have great balance between well delivered lectures and facilitated class discussions. Students are evaluated in Socy 69 by 2 take home exams and 1 research project. His grading criteria is clear. Do not expect to get a good grade without doing the readings and spending time on research/writing. Expect to learn a lot!,False,2016-07-01 18:23:11,4.0,A-,5.0,True,False,5.0,,0.0,0,0,1.0,698787
288,mandatory,5.0,SOCY1,"Lots of reading (a book a week or so), but Campbell chooses books that are actually interesting and relevant to the material. Campbell's a really good lecturer, but make sure you either (1) go to class or (2) have a friend who takes really good notes, because otherwise you won't have any way of getting the material. ",False,2014-11-13 11:39:19,3.0,,3.0,True,False,4.0,,4.0,0,0,,698787
289,,5.0,SOCY1,No Comments,False,2005-10-26 22:49:05,5.0,,2.0,False,False,4.0,,,0,0,,698787
290,mandatory,1.0,COSC50,"Such a bad professor. Do not take it with him. Arrogant, cold, and cannot teach.",False,2016-07-18 16:52:18,5.0,,1.0,True,False,1.0,,0.0,0,1,0.0,597700
291,,3.0,CS37,"Took CS37 and CS78 from him.  The median grade on the exams for CS37 was something like a 50, so that should tell you a lot.  Did not do a great job actually teaching us the material",False,2013-05-23 13:05:44,5.0,,2.0,False,False,3.0,,4.0,0,1,,597700
292,,5.0,COSC78,Best CS class offered.  Finally a class where you don't spend 3/4 of it proving O(n) for something and only 1/4 learning real stuff that you might use!  Take this class.  You won't regret it.,False,2005-04-14 15:57:39,2.0,,5.0,False,False,5.0,,,0,0,,597700
293,mandatory,5.0,WRIT5,"Heck high expectations but rewards hard work, even if you are just learning how to be a student at Dartmouth. Best experience I've had to date, in or out of the classroom.",False,2016-11-11 00:28:46,4.0,,5.0,True,False,5.0,Respected--ACCESSIBLE OUTSIDE CLASS--Caring,0.0,0,0,1.0,286676
294,Y,5.0,WRIT5,"She has very high expectations, and will call you out if you're just sliding by in the course. But she also is extremely eager to help students succeed, and her ability to lead class discussions is excellent.",False,2013-10-15 09:30:07,4.0,,5.0,False,False,5.0,,4.0,0,0,,286676
295,,5.0,ARTH52,Best I had at Dartmouth,False,2006-10-10 17:09:01,4.0,,5.0,False,False,5.0,,3.0,1,0,,286676
296,Y,5.0,JAPN10,"Great class, great professor.",False,2014-05-05 12:27:22,3.0,A-,5.0,False,False,5.0,,3.0,0,1,,741911
297,,4.0,JAPAN11,Prof Dorsey is funny and smart. You can tell he cares about the students.,False,2006-11-07 21:27:55,3.0,,5.0,False,False,5.0,,3.0,0,0,,741911
298,,5.0,JAPANESECULTUR,Jim is a great teacher. Incredibly smart and very funny.,False,2006-01-14 12:40:14,4.0,,5.0,False,False,5.0,,,0,0,,741911
299,mandatory,5.0,WRIT005,"I loved Professor Kremers writing class! She always provided reasonable feedback and had clear expectations from the start of the term. Her class greatly improved my writing, and she is such a sweetheart as well. I recommend talking to her outside of class in case you have any questions or concerns because she tries to be as accessible as can be!",False,2021-03-27 07:26:41,3.0,A+,5.0,True,False,5.0,Gives good feedback--Accessible outside class--Caring,0.0,0,0,1.0,1328911
300,mandatory,4.0,MATH007,Pretty solid writing seminar,False,2017-03-26 17:24:38,2.0,A,4.0,True,False,4.0,Clear grading criteria--GRADED BY FEW THINGS--Caring,0.0,0,0,1.0,1328911
301,Y,3.0,WRIT005,Average writing seminar. I think my friends enjoyed some of theirs more.,False,2013-08-23 02:43:27,3.0,B+,3.0,False,False,3.0,,4.0,0,0,,1328911
302,,5.0,ENGL54,"As it was my 2nd course with McCann, I knew what I was getting into, but was still very impressed with the quality and insights provided. The assignments were interesting and supplemented the readings well. I appreciated the insight into different literary contexts and theoretical frameworks. Very thought-provoking and life-changing. TAKE THIS.",False,2016-02-03 18:22:03,3.0,A,4.0,True,False,5.0,,4.0,0,0,,642919
303,,5.0,ENGL23,"Wonderful professor. Lectures are clear and insightful, assignments are reasonable, and reading is manageable (mostly poetry). He does not micromanage you with the papers (length and frequency) or attendance/participation, which I appreciated. Wry sense of humor and really caring. Most importantly, he got me invested in romanticism and poetry!",False,2016-02-03 18:16:45,3.0,A,5.0,True,False,5.0,,4.0,0,0,,642919
304,,4.0,ENG007,"I have no interest in Literature or poetry, but still the classes were interesting and you have to pay attention because you can get called on randomly",False,2013-02-11 15:44:14,2.0,,3.0,False,False,4.0,,2.0,0,1,,642919
305,,5.0,ENGL22,"Doesn't always lecture on the most interesting stuff, but he's knowledgeable and full of energy.",False,2012-02-19 10:55:08,3.0,,4.0,False,False,5.0,,2.0,0,1,,691632
