index,attendance_mandatory,clarity_rating,class,comment,created_by_user,date,difficulty_rating,grade,helpful_rating,is_for_credit,is_for_online_class,quality_rating,rating_tags,textbook_use,thumbs_down_total,thumbs_up_total,would_take_again,pid
306,,5.0,ENGL15,"Professor Edmondson is wonderful!! He is the best professor: so brilliant, insightful, and genuine. And it is obvious he cares about his students and wants everyone to feel involved and welcome in his class. He is an ideal professor!",False,2007-01-18 20:12:20,4.0,,5.0,False,False,5.0,,5.0,0,1,,691632
307,,4.0,ENGLISH8,"Professor Edmondson is great!! I can come into class on a monday morning just wanting to go home and sleep, and leave feeling invigorated, and excited about literature.  He's young, funny, and very helpful.Take his classes, you won't regret it!",False,2005-11-17 15:49:24,3.0,,5.0,False,False,5.0,,,0,1,,691632
308,,1.0,FYS,"Only prof I ever had who fell asleep in his own seminar class! It was a 6-student First Year seminar with a sexy title: Persia Iran, Images & Reality. It met after lunch. Prof. came in stinking of onions & mustard. After a few introductory words, Garthwaite would launch a discussion & proceed to fall asleep! We green 'shmen knew not what to do :(",False,2014-10-26 02:10:48,1.0,,2.0,True,False,2.0,,1.0,2,0,,1178158
309,,5.0,HIST99,"Great guy, excellent professor.",False,2010-06-23 22:58:54,1.0,,5.0,False,False,5.0,,5.0,0,1,,1178158
310,,5.0,HIST5,"A brilliant expert in Islam, the Arab-Israeli Conflict, and Ancient Persia, Gene Garthwaite is one of the most gifted teachers at Dartmouth.",False,2008-09-11 11:49:24,2.0,,5.0,False,False,5.0,,3.0,0,1,,1178158
311,,4.0,MATH73,Just fantastic.  Easily my favorite professor.,False,2012-03-01 11:30:52,4.0,,4.0,False,False,4.0,,1.0,0,0,,895047
312,,5.0,MATH73,One of the best teachers I've ever had for any subject.,False,2010-05-20 22:29:13,4.0,,5.0,False,False,5.0,,2.0,0,0,,895047
313,,5.0,MATH012,"Brilliant, sublime;",False,2006-09-28 07:29:04,5.0,,5.0,False,False,5.0,,5.0,0,0,,895047
314,,5.0,ENGS21,Awesome professor. Very interesting and fun. Helpful for projects and very easy to talk to. Cares about students and his research is very interesting. One of the great Thayer professors,False,2012-09-13 17:19:53,3.0,,4.0,False,False,5.0,,1.0,0,1,,1169015
315,,1.0,ENGS290,No Comments,False,2009-06-28 02:31:32,1.0,,1.0,False,False,1.0,,1.0,1,0,,1169015
316,,5.0,ENGS21,"Collier rocks!  Forbes sucks!  I can't believe there was only one engineering prof on this site for their article.  Forbes, you officially will never sell me another magazine.  About Collier: enthusiastic, friendly, fun, owns a zamboni so super-cool.",False,2008-08-22 11:03:43,5.0,,5.0,False,False,5.0,,2.0,0,1,,1169015
317,mandatory,5.0,ANTH048,"Prof. Kan is a brilliant professor and scholar. His lectures and interesting material inspired me to get involved in Native American matters. I enjoyed his classes to the fullest, learned greatly through his extensive knowledge and believe it was a true privilege to have him teach me. I highly recommend him to everyone. ",False,2024-02-06 22:01:21,3.0,A-,5.0,True,False,5.0,Get ready to read--Amazing lectures --Inspirational,3.0,0,0,1.0,404252
318,,3.0,ANTH048,"Kan is this cute old guy who wants to be really helpful and loves his subject. He tends to go off on tangents too often, though.",False,2012-02-19 11:12:22,2.0,,5.0,False,False,4.0,,3.0,0,3,,404252
319,,2.0,ANTHRO14,No Comments,False,2004-06-27 21:24:29,3.0,,2.0,False,False,2.0,,,3,0,,404252
320,mandatory,5.0,WRIT23,Boone is legendary. She's a wonderful prof and one you'll always remember! Very impactful person.,False,2017-05-22 13:12:05,4.0,A,5.0,True,False,5.0,,5.0,0,0,1.0,691619
321,,5.0,ENG003,Awesome English Instructor!,False,2016-12-14 14:36:46,5.0,A+,5.0,True,False,5.0,,5.0,0,0,1.0,691619
322,,5.0,WRIT23,She is an amazing professor! I recommend to any and everyone.,False,2013-05-24 12:15:06,5.0,,5.0,False,False,5.0,,1.0,0,0,,691619
323,,5.0,WRIT5,Good professor!,False,2010-09-10 16:22:16,3.0,,5.0,False,False,5.0,,3.0,0,0,,691631
324,,4.0,WRIT5,Best Professor ever! Go Dartmouth!,False,2008-08-19 08:21:04,1.0,,5.0,False,False,5.0,,2.0,0,0,,691631
325,,1.0,WRIT5,No Comments,False,2006-10-03 12:48:56,3.0,,1.0,False,False,1.0,,1.0,0,0,,691631
326,,5.0,JS613,Rebbitzin is a very special and holy Person!,False,2012-06-01 01:24:08,1.0,,5.0,False,False,5.0,,2.0,1,1,,1620628
327,,5.0,JS613,Rebbitzin is someone you should get close to and know how holy she is!,False,2012-06-01 01:22:06,1.0,,5.0,False,False,5.0,,1.0,1,1,,1620628
328,,5.0,JS613,"Best person Ever! S he has the most amazing ""yichus""",False,2012-06-01 01:19:46,1.0,,5.0,False,False,5.0,,5.0,2,1,,1620628
329,mandatory,5.0,CS50,Good teacher and interesting projects,False,2016-01-05 06:48:49,1.0,,5.0,False,False,5.0,,5.0,1,1,,1923223
330,,5.0,CS60,The project is the best I ever had.,False,2015-03-02 23:52:02,1.0,,4.0,True,False,5.0,,1.0,0,1,,1923223
331,mandatory,2.0,CS60,The grade policy was not clear for class participation.,False,2014-10-02 15:59:59,5.0,,1.0,True,False,2.0,,1.0,3,0,,1923223
332,non mandatory,5.0,PSYC023,"Awesome instructor. Super engaging, funny, totally knows her stuff.",False,2017-11-11 18:38:03,3.0,A,5.0,True,False,5.0,Respected--Inspirational--Amazing lectures,5.0,0,0,1.0,1353133
333,non mandatory,5.0,PSYC001,"Really cool research into music, free will, and hypnosis. She hypnotized the whole class once (100 people) and I think I fell in love with her after that.",False,2016-02-10 17:21:14,3.0,A,5.0,True,False,5.0,,5.0,0,1,,1353133
334,,5.0,PSYC023,"Professor Wheatley is great! Funny, engaging, fair, great lecturer. I highly recommend getting to know her outside of class.",False,2013-03-18 17:20:17,2.0,,5.0,False,False,5.0,,3.0,1,2,,1353133
335,,5.0,BIOL11,"Literally the GOAT such an engaging teacher, decent class and pretty hard but prof Peterson literally made this my favorite class. Very engaging, and really nice person. The one thing to be aware of is that he sometimes cold calls people. Other than this best prof ever.",False,2020-10-30 17:31:48,3.0,B+,5.0,True,True,5.0,,0.0,0,0,1.0,1411645
336,mandatory,4.0,BIOL06,I absolutely loved this class! It was more focused on cladistics and the dinosaur tree than I was expecting but it was a really neat way to learn about evolution through the lens of dinosaurs. You definitely have to put the effort in studying because he makes it clear what he wants you to know. You've got to do the work to succeed in this class.,False,2015-06-15 20:44:29,4.0,,4.0,True,False,4.0,,1.0,0,1,,1411645
337,,3.0,BIOL06,"A nice enough professor, but &quot;Dinosaurs&quot; was not what I had expected. He focused mainly on dinosaur cladistics, classifying them into various groups/subgroups/etc. based on their physical characteristics. I didn't find this approach illuminating for an introductory course, and the exams on cladograms were extraordinarily nitpicky and difficult.",False,2010-02-24 07:46:01,5.0,,3.0,False,False,3.0,,1.0,0,0,,1411645
338,,1.0,ENGS22,"This class was truly horrible. Maybe Lee Lynd can set up a lab to do biofuels, but as a professor and a person he is horrendous. It sickens me how much disrespect he has for others. Towards students he is rude and arrogant. He didn't bother to show up for majority of the course. ",False,2014-12-13 12:16:14,3.0,A-,1.0,True,False,1.0,,3.0,1,0,,597689
339,,4.0,ENGS22,I found this class to be very useful in giving an idea about what all the different engineering disciplines involve.  Great class.  Good prof.,False,2005-04-14 15:52:31,2.0,,5.0,False,False,5.0,,,0,1,,597689
340,mandatory,2.0,WRIT5,"She is well-versed in critical analysis, as she has listed off her credentials multiple times in class. Still, she comes off as insecure quite often and is often wasteful of class time. She has been known to be rude, and she tends to talk around problems rather than addressing them. Students pretend to listen; syllabus very unclear.",False,2015-10-22 10:54:54,4.0,A,1.0,True,False,2.0,,1.0,0,0,,759721
341,,5.0,WRITING5,"She's a tough grader, that much is true.  She definitely doesn't have any tolerance for things such as tardiness, missing class, missing deadlines etc...But she is also very reasonable, will work hard with you to make you a better writer, and is not out to make your life horrible.  She just pushes you hard, so you can get the most out of the class.",False,2005-11-17 15:45:08,4.0,,4.0,False,False,5.0,,,0,0,,759721
342,,5.0,MUS010,Summers is so good!!!,False,2012-08-03 02:50:13,1.0,,5.0,False,False,5.0,,5.0,0,0,,822033
343,,1.0,MUS6,Yuch!,False,2007-08-01 16:44:38,1.0,,1.0,False,False,1.0,,2.0,1,0,,822033
344,,5.0,HIST36,"Very interesting topic but not advised to take freshman year... great structure and straightforward. Speak up, skim readings and you will be just fine.",False,2013-03-05 03:05:42,3.0,,5.0,False,False,5.0,,4.0,0,0,,1013386
345,,5.0,HIST36,"Great Prof, great lectures and made the history of healthcare interesting. Speak up in the discussion sessions, dont be afraid to make your point and get to know Koop, pretty good guy.",False,2009-12-22 14:59:50,3.0,,4.0,False,False,5.0,,4.0,0,0,,1013386
346,,5.0,ENGL41,"Says 'yeah' a lot when responding to people but it's just because she's excited and loves what she's teaching, and I've found that infectious. Really nice and willing to work with people, and also knows a ton. Loved having her.",False,2012-02-19 10:51:09,3.0,,5.0,False,False,5.0,,4.0,0,0,,691613
347,,4.0,ENGL15,One of the best at Dartmouth/,False,2009-04-14 16:40:03,4.0,,4.0,False,False,4.0,,5.0,0,0,,691613
348,,3.0,ENG57,"Post-modern lit- the reading is interesting, but he don't make very much sense. He enjoys speaking in riddles and contradictions. Also, you will never meet him.",False,2012-06-13 21:43:28,2.0,,2.0,False,False,3.0,,5.0,3,0,,691634
349,,4.0,WRIT05,"Noy yoo bad, lots and lots of writing though. Decent- easy grader.",False,2010-12-03 22:37:42,3.0,,5.0,False,False,5.0,,5.0,1,1,,691634
350,non mandatory,5.0,PHYS042,"Greatest professor in the whole college. Seriously, the only stand-up dude I've met at this place. Really knows his physics and has a very relaxed stance towards teaching. ""If you wanna learn, I am here. If you don't, I am not gonna complain about it."" He knows that every person lives a different life.",False,2017-06-04 17:57:26,3.0,A,5.0,True,False,5.0,Amazing lectures,5.0,0,0,1.0,1173168
351,,5.0,PHYS024,One of the kindest and greatest professors I have had at Dartmouth.,False,2012-08-03 02:40:09,1.0,,5.0,False,False,5.0,,2.0,0,0,,1173168
352,non mandatory,5.0,ECON22,"Walk into the middle of a J Fey class and you're gonna be looking at something akin to a war room, with tons of graphs and drawings on the blackboard and slides flying by at a blistering pace. Amazing lecturer, but he needs to go a WHOLE lot slower in clas. Then again, that's what office hours are for, and Feyrer is definitely there to help you.",False,2015-11-24 09:53:28,2.0,A,5.0,True,False,5.0,,2.0,0,3,,886248
353,,5.0,ECON22,No Comments,False,2008-05-26 12:33:10,2.0,,1.0,False,False,3.0,,5.0,2,0,,886248
354,non mandatory,5.0,MATH1,"very nice, knows what he's doing, avaibale to help",False,2022-04-27 12:32:53,3.0,,5.0,True,False,5.0,Caring--Lecture heavy--Accessible outside class,-1.0,0,0,1.0,2288975
355,,5.0,MATH1,"Chris is awesome, you can really tell he cares that you get it",False,2017-12-02 21:11:33,4.0,A-,5.0,True,False,5.0,ACCESSIBLE OUTSIDE CLASS--Caring--LECTURE HEAVY,5.0,0,0,1.0,2288975
356,,5.0,STATS,Extremely engaging. Amazing energy levels. Ensures concepts are drilled in.,False,2014-11-18 10:26:35,1.0,,5.0,True,False,5.0,,5.0,0,0,,1673272
357,,5.0,STATS3,One of the best professors I have learnt from. He is able to teach the dry subject with utmost enthusiasm and insight.,False,2011-12-20 23:56:51,4.0,,5.0,False,False,5.0,,1.0,0,0,,1673272
358,non mandatory,1.0,ENGS05,badprofessor and definitely not the best professor at Dartmouth. Not very accommodating. Very distant and seems uninterested in teaching undergraduates.,False,2016-06-05 09:54:12,3.0,B,1.0,True,False,1.0,,0.0,0,0,0.0,1173175
359,,5.0,ENGS12,Best class and best professor at Dartmouth.,False,2015-04-19 23:04:58,3.0,,5.0,True,False,5.0,,1.0,0,0,,1173175
360,,4.0,LING1,Great Prof,False,2015-11-19 23:44:41,3.0,,5.0,True,False,5.0,,3.0,0,0,,1909620
361,N,1.0,LING1,"He's boring, unnecessarily rigid, and unhelpful. Linguistics is a fun subject, but take it with another prof.",False,2014-07-09 15:47:31,3.0,,1.0,False,False,1.0,,3.0,0,5,,1909620
362,,5.0,TU101,"A wonderful Prof, he is not an expert in just one thing, but has an overview of the world. This class opened my eyes...",False,2010-03-10 00:08:28,3.0,,5.0,False,False,5.0,,2.0,0,0,,1254286
363,,5.0,EIS1,Excellent professor!,False,2009-02-11 14:38:23,4.0,,5.0,False,False,5.0,,2.0,0,0,,1254286
364,non mandatory,5.0,GOVT50,He is so very good. He is the best prof I've EVER had.,False,2017-05-05 18:18:13,5.0,Rather not say,5.0,True,False,5.0,Tough Grader--Hilarious--Amazing lectures,0.0,0,0,1.0,1103611
365,,5.0,NUKES01,Awesome Prof.,False,2011-08-08 18:39:12,5.0,,4.0,False,False,5.0,,2.0,0,0,,1103611
366,mandatory,5.0,COSC099,I learned many things in her class about HCI that I will never forget.  Thank you,False,2017-04-13 20:12:03,3.0,A,5.0,True,False,5.0,BEWARE OF POP QUIZZES--SO MANY PAPERS--GROUP PROJECTS,5.0,0,0,1.0,240606
367,,1.0,CS99,Seriously... do the thesis.,False,2005-06-16 11:14:42,1.0,,1.0,False,False,1.0,,,1,0,,240606
368,mandatory,5.0,PHYS104,Great lecturer. Explains clearly and classes  are well prepared. Tough but fair grader. Does not hand out indiscriminate high passes as other professors do so she has an unfairly bad rep.,False,2022-08-14 23:28:59,4.0,A,5.0,True,False,5.0,Tough grader--Get ready to read--Amazing lectures ,3.0,0,0,1.0,2160975
369,mandatory,1.0,PHYS104,"Known for her Arrogance. She might have been a promising researcher 20 years ago, but has failed to deliver since then. She is unreasonably harsh when grading.",False,2021-07-31 04:15:27,3.0,,1.0,True,False,1.0,Tough grader,5.0,0,0,0.0,2160975
370,,5.0,PSYCH1,Great teacher,False,2013-03-27 00:48:59,2.0,,5.0,False,False,5.0,,3.0,0,1,,424824
371,,5.0,PSYCH1,he specializes in visual perception and studying visual consciousness.,False,2008-09-09 23:01:51,4.0,,5.0,False,False,5.0,,3.0,0,1,,424824
372,,5.0,PHIL31,"Professor Levey was terrific, a really thoughtful professor who sought to engage the class.  He was also welcoming and kind in office hours --- someone striving to develop your thought process.",False,2011-05-26 20:45:08,3.0,,5.0,False,False,5.0,,5.0,0,1,,803090
373,,1.0,PHIL80,No Comments,False,2006-12-11 22:25:19,5.0,,1.0,False,False,1.0,,1.0,4,0,,803090
374,mandatory,3.0,WRIT5,"Dobson is alright, he's kinda funny. Also thinks he's really, really smart, so the best way to get an A is to flatter him. Frankly, his Dart history course is boring as heck, but I think that's mostly because of the W5 constraints and not his own fault.",False,2018-03-22 01:07:49,2.0,A-,3.0,True,False,3.0,Get ready to read--SO MANY PAPERS,5.0,4,0,0.0,1918505
375,Y,5.0,WRIT5,Dobson is funny and smart. Office hours helpful.,False,2014-09-05 16:21:05,3.0,A,5.0,False,False,5.0,,4.0,0,21,,1918505
376,non mandatory,5.0,PHIL037,His classes are very informative and challenging!,False,2018-07-18 07:50:35,4.0,,5.0,True,False,5.0,Gives good feedback--Get ready to read--Inspirational,0.0,0,0,1.0,1588761
377,,3.0,PHIL008,Rosenkoetter is a great guy and a good professor. Would recommend his class!,False,2015-02-17 16:42:29,3.0,,4.0,True,False,4.0,,5.0,1,0,,1588761
378,non mandatory,5.0,ANTH1,"Good prof, knowledgeable, helpful.",False,2017-10-19 10:59:40,3.0,A,5.0,True,False,5.0,Gives good feedback--Respected--Clear grading criteria,0.0,0,0,1.0,24790
379,,4.0,ANTH1,He's very kind and engaging. His Anthropology 1 class revealed many connections I would not have imagined before.,False,2010-12-11 09:58:28,4.0,,5.0,False,False,5.0,,3.0,0,1,,24790
380,,5.0,ENGS20,"Best prof I've had at Dartmouth, which is saying a lot. Clearly loves to teach, and is great at it, too. His combination of commitment and ability made scientific computing a way more enjoyable experience than it has any business being for a beginner.",False,2014-08-18 15:21:26,3.0,,5.0,False,False,5.0,,2.0,1,1,,1173165
381,,5.0,ENGS20,No Comments,False,2008-08-28 20:45:35,4.0,,5.0,False,False,5.0,,1.0,2,0,,1173165
382,,4.0,MICRO264,"A great professor. Is hard on student who don't want to put in the effort to learn, but if asked for help he will bend over backwards to make sure that a student understands. Doesn't post lecture slides but will send to students if asked; he just doesn't want people skipping class.",False,2010-11-17 22:49:10,4.0,,5.0,False,False,5.0,,2.0,0,2,,636005
383,,1.0,MICRO264,No Comments,False,2005-06-24 17:08:31,5.0,,1.0,False,False,1.0,,,2,0,,636005
384,,1.0,MATH3,i dont know what that person was talking about but he was not a good math prof at all. i could name the four math teachers i had in high school and i would take them over him anyday.,False,2010-01-25 17:08:25,4.0,,1.0,False,False,1.0,,1.0,0,0,,915284
385,,5.0,MATH71,"Great prof, for a math class. He is nice and it tends to be on the easy side! Professor Pomerance is awesome.",False,2007-01-18 20:15:19,4.0,,5.0,False,False,5.0,,5.0,0,0,,915284
386,,5.0,ANTH17,"Lots of readings if you're from the sciences like me, but learnt a lot",False,2014-11-21 13:49:25,1.0,,5.0,True,False,5.0,,3.0,0,0,,1944400
387,mandatory,5.0,ANTH17,"Inspirational.  Made me want to become an Anthro major. Not the easiest class, but still actually looked forward to the readings and lectures, for a change, best I've taken at Dartmouth.",False,2014-11-17 12:46:35,1.0,,5.0,True,False,5.0,,3.0,0,0,,1944400
388,mandatory,5.0,WRIT007,"She was a fantastic professor and really tailored her comments on my writing to the student. She was in tune with the class, and I would absolutely take another class with her. Participate in her class, but there were only three essays (short, too) for the whole class. Attendance is taken, and she knows everybody by name.",False,2017-03-23 22:34:26,3.0,A-,5.0,True,False,5.0,Gives good feedback--Participation matters--Caring,0.0,0,0,1.0,1881977
389,Y,3.0,WRIT0023,"Very smart, but her teaching methods are quite boring and hardly fun.",False,2014-02-27 12:39:42,3.0,Pass,3.0,False,False,3.0,,2.0,1,0,,1881977
390,mandatory,2.0,MATH23,"All seemed to go well until week 3, at which point he shifted the class' focus from real-world applications to obscure and narrowly applicable proofs. Good presence and witty commentary, but treats in-class questions with a fiercely derisive and hostile attitude, which is even worse during office hours. Do not take his 23 if you are PHYS/CHEM/ENGS",False,2015-11-05 14:40:10,4.0,,1.0,True,False,2.0,,3.0,3,0,,915288
391,,3.0,MATH23,"Great prof.  Once you get past his accent, he explains ideas clearly and logically.  He prepared lecture notes for us, to be handed out before each class, which were very helpful.",False,2008-08-16 20:40:10,3.0,,5.0,False,False,4.0,,4.0,1,4,,915288
392,,5.0,ECON1,Curtis is the best Econ 1 teacher,False,2009-10-31 13:13:02,4.0,,5.0,False,False,5.0,,3.0,2,0,,1099416
393,,5.0,ECON01,Great teacher and easy on the eyes!,False,2008-01-30 12:59:05,2.0,,5.0,False,False,5.0,,4.0,0,0,,1099416
394,non mandatory,5.0,PHYS13,Prof Caldwell is truly passionate about physics and beings that passion into this class.,False,2020-06-02 17:28:23,2.0,A,5.0,True,False,5.0,Gives good feedback--Accessible outside class,5.0,0,0,1.0,1541109
395,,5.0,PHYS14,Great Professor!,False,2011-05-03 11:15:09,5.0,,5.0,False,False,5.0,,5.0,0,0,,1541109
396,,2.0,LACS7,Only take class if you LOVE film analysis because prof graded randomly with no rubric. Never explained what she wanted in class,False,2021-03-27 07:21:35,3.0,,2.0,True,False,2.0,Tough grader,0.0,0,0,0.0,2680341
397,mandatory,2.0,LACS7,"Professor grades too harshly. Never had clear expectations nor rubrics. Received an 80% on an essay when comments had praises about analysis. But because of 1-2 comments pointing out my passive voice, I got an 80. Grades based on passive voice and small grammatical errors not content.",False,2021-03-27 04:57:27,4.0,A-,2.0,True,False,2.0,Get ready to read--Graded by few things--Tough grader,0.0,0,0,0.0,2680341
398,non mandatory,5.0,ENGS22,Professor Stauth truly cares about his students and wishes for them to learn for the sake of learning rather than grades. He is able to explain complex topics in a way that anyone could understand. He is an inspiration and all teachers should aspire to his level.,False,2023-04-20 15:45:11,3.0,A,5.0,True,False,5.0,Amazing lectures --Inspirational--Respected,3.0,0,0,1.0,1907127
399,non mandatory,4.0,ENGS22,Breaks down the material very well. Great prof to learn from.,False,2017-03-04 18:36:59,3.0,A,4.0,True,False,4.0,ACCESSIBLE OUTSIDE CLASS--Caring,0.0,0,0,1.0,1907127
400,,5.0,ENGL80,"Barbara Dimmick was one of the best professors I had in my 4 years at Dartmouth (if not THE best). Besides being extremely helpful, she encourages creativity and runs an excellent workshop. She knows her stuff inside and out-- a wonderful professor.",False,2008-05-20 23:53:45,4.0,,5.0,False,False,5.0,,2.0,0,0,,393526
401,,2.0,ENGLISH80,No Comments,False,2004-04-23 15:38:31,5.0,,1.0,False,False,2.0,,,0,0,,393526
402,Y,5.0,COCO5,"Dr. Desjardins is a great professor and I really enjoyed her class. She's very knowledgeable, fair, and helpful during office hours. I was never really interested in film until I took her class as an elective but I ended up really liking it and learning a lot. I would definitely take another class with Dr. Desjardins.",False,2014-05-21 20:54:40,3.0,A,5.0,False,False,5.0,,3.0,0,0,,659208
403,,4.0,FILM47,No Comments,False,2008-08-19 13:24:40,3.0,,5.0,False,False,5.0,,4.0,0,0,,659208
404,,4.0,ENG35,"Great professor, truly passionate about literature.",False,2009-07-23 00:50:12,4.0,,5.0,False,False,5.0,,4.0,0,0,,691626
405,,4.0,POETRY,No Comments,False,2006-04-15 09:37:33,4.0,,3.0,False,False,4.0,,,0,0,,691626
406,,5.0,FILM42,"She is extremely knowledge about the field and her enthusiasm for teaching and learning is truly infectious. She makes the content relatable and applicable to real life situations. The class is mostly discussion-based so if you?re interested in deep, thought provoking, and challenging conversations; I highly recommend taking one of her courses.",False,2011-03-11 14:39:11,2.0,,5.0,False,False,5.0,,3.0,0,0,,1006121
407,,5.0,FILM42,"She is an astounding professor.She was not only inspirational and knowledgable, she actually cared about her students and teaching.Her class has been one of my most favorite at Dartmouth.I have no idea why that review says she's horrible (sounds like someone was not happy with their grade).She is such a gifted and talented communicator. Top notch!",False,2010-12-10 18:55:40,3.0,,5.0,False,False,5.0,,4.0,0,0,,1006121
408,,5.0,WRIT005,"First and best class I've ever took at Dartmouth. Crocker is a baller. He taught me how to write better than any professor I've previously had. If he ever offers the Writing 5 class on happiness, I would highly recommend signing up for it.",False,2010-08-05 11:06:07,5.0,,5.0,False,False,5.0,,4.0,0,0,,1165647
409,,5.0,ENGL120,Excellent Professor,False,2009-03-19 13:59:10,4.0,,5.0,False,False,5.0,,3.0,0,0,,1165647
410,,2.0,MYTH110,"Very short; unfriendly attitude. Opinionated and unwelcoming, however very knowledgeable subject mater expert.",False,2010-07-29 12:14:54,3.0,,1.0,False,False,2.0,,3.0,0,0,,1049691
411,Y,4.0,SPAN003,"Cutest old lady ever, and a great teacher.",False,2014-02-27 12:36:51,1.0,B,5.0,False,False,5.0,,4.0,0,0,,1881976
412,mandatory,5.0,LAT1,Great prof! Got me into the subject and ended up majoring in Classics! Such a sweet professor but also tough and fair.,False,2016-03-04 12:50:28,3.0,A,5.0,True,False,5.0,,4.0,1,0,,1887445
413,,5.0,POLISCI100,Best Prof ever. Always there for the students and ready to answer any questions. Kyle cares.,False,2015-11-13 19:28:06,4.0,B,5.0,True,False,5.0,,5.0,0,0,,1928113
414,,2.0,COSC10,"Lectures are fairly boring (probably not Drysdale's fault- it's hard to make data structures interesting) and sometimes confusing, but office hours are helpful if you make the time to go. Outside of class Drysdale is great- definitely the kind of prof who wants to see you succeed.",False,2014-11-13 11:31:28,2.0,,3.0,True,False,3.0,,2.0,0,0,,1942072
415,,5.0,PHYS013,Lots of out of class work but great lecture style.,False,2017-07-17 20:48:26,4.0,A,5.0,True,False,5.0,Gives good feedback--LOTS OF HOMEWORK--Amazing lectures,0.0,0,2,1.0,2270348
416,non mandatory,2.0,MATH3,Class didnt define how hard it was going to be - half the class dropped out. Only the best can really survive it because the curve is horrifying.,False,2017-11-16 01:23:15,5.0,Drop/Withdrawal,2.0,True,False,2.0,Tough Grader--LOTS OF HOMEWORK--TEST HEAVY,5.0,1,0,0.0,2282943
417,,5.0,MUS53,He's pretty much the human embodiment of jazz.,False,2018-07-23 14:49:58,2.0,,5.0,False,False,5.0,Respected--Inspirational--Caring,0.0,0,0,1.0,1802549
418,mandatory,5.0,ECON39,"Professor Johnson is a giant of an individual and an absolutely solid lecturer. He always wins smiles from his students and has a sense of humor that is preferred by many. For a great story, ask him about his experiences with Olympic Hammer Toss (not for the faint of heart!)",False,2019-08-15 13:57:18,4.0,A-,5.0,True,False,5.0,Gives good feedback--Respected--Amazing lectures,5.0,0,0,1.0,2500215
